title,link,description,pubdate,location,timestamp
"Sr Software Engineer, Fraud",https://echojobs.io/job/oportun-sr-software-engineer-fraud-3j56z,"ABOUT OPORTUN
Oportun (Nasdaq: OPRT) is a digital banking platform that puts its 1.9 million members financial goals within reach. With intelligent borrowing savings budgeting and spending capabilities Oportun empowers members with the confidence to build a better financial future. Since inception Oportun has provided more than $15.5 billion in responsible and affordable credit saved its members more than $2.3 billion in interest and fees and helped our members save an average of more than $1800 annually. For more information visit Oportun.com.
 
WORKING AT OPORTUN
Working at Oportun means enjoying a differentiated experience of being part of a team that fosters a diverse equitable and inclusive culture where we all feel a sense of belonging and are encouraged to share our perspectives. This inclusive culture is directly connected to our organizations performance and ability to fulfill our mission of delivering affordable credit to those left out of the financial mainstream. We celebrate and nurture our inclusive culture through our employee resource groups.
POSITION OVERVIEW
As a Senior Software Engineer at Oportun you will be a key member of our engineering team responsible for designing developing and maintaining sophisticated software solutions in achieving the charter of the engineering group. Your mastery of a technical domain enables you to take up business problems and solve them with a technical solution. With your depth of expertise and leadership abilities you will actively contribute to architectural decisions mentor junior engineers and collaborate closely with cross-functional teams to deliver high-quality scalable software solutions that advance our impact in the market. This is a role where you will have the opportunity to take up responsibility in leading the technology effort – from technical requirements gathering to final successful delivery of the product - for large initiatives (cross-functional and multi-month long projects).
RESPONSIBILITIES

You actively contribute to the end-to-end delivery of complex software applications ensuring adherence to best practices and high overall quality standards.
You have a strong understanding of a business or system domain with sufficient knowledge & expertise around the appropriate metrics and trends. You collaborate closely with product managers designers and fellow engineers to understand business needs and translate them into effective software solutions.
You provide technical leadership and expertise guiding the team in making sound architectural decisions and solving challenging technical problems. Your solutions anticipate scale reliability monitoring integration and extensibility.
You conduct code reviews and provide constructive feedback to ensure code quality performance and maintainability. You mentor and coach junior engineers fostering a culture of continuous learning growth and technical excellence within the team.
You play a significant role in the ongoing evolution and refinement of current tools and applications used by the team and drive adoption of new practices within your team.
You take ownership of (customer) issues including initial troubleshooting identification of root cause and issue escalation or resolution while maintaining the overall reliability and performance of our systems.
You set the benchmark for responsiveness and ownership and overall accountability of engineering systems.
You independently drive and lead multiple features contribute to (a) large project(s) and lead smaller projects. You can orchestrate work that spans multiples engineers within your team and keep all relevant stakeholders informed. You support your lead/EM about your work and that of the team that they need to share with the stakeholders including escalation of issues

 
REQUIREMENTS:

Typically requires a minimum 6 years of related experience with a Bachelors degree; or a Masters degree with an equivalent combination of education and experience.
Proven track record of delivering sophisticated software solutions with high quality.
Extensive proficiency in one or more programming languages such as Java or similar.



Strong understanding of data structures algorithms and software design principles.
Demonstrated experience in web application development RESTful APIs and frontend technologies (e.g. HTML CSS JavaScript) is advantageous.
Proficiency in working with relational databases and SQL is a plus.
Solid grasp of version control systems such as Git.
Experience with cloud technologies preferably AWS or Azure is highly desirable.
Knowledge on docker and Kubernetes
CI/CD process exposure
Good to have knowledge on automation test frameworks like Karate framework Web driver I/O Jira workflow
Proven ability to mentor and lead other engineers fostering a collaborative and supportive work environment.
Exceptional problem-solving and analytical skills with a passion for tackling complex technical and business problems/challenges.
Excellent communication and interpersonal abilities with a track record of effectively collaborating in a team-oriented environment.

 
Why Join Us:
If you are passionate about leveraging technology to make a positive social impact and are
excited to contribute to our mission we invite you to apply for the role of Associate Software Engineer at Oportun. Join us to shape the future of responsible finance and improving the lives of hard-working individuals and families.

Make a meaningful impact by contributing to solutions that address real-world financial challenges for underserved communities.
Experience a collaborative and inclusive work culture that values innovation and diversity.
Take advantage of opportunities for professional growth and skill development through mentorship and training.
Enjoy competitive compensation package including benefits
Achieve work-life balance and flexibility to support your personal and professional well- being.

#LI-REMOTE
#LI-GK1We are proud to be an Equal Opportunity Employer and consider all qualified applicants for employment opportunities without regard to race age color religion gender national origin disability sexual orientation veteran status or any other category protected by the laws or regulations in the locations where we operate.
 
California applicants can find a copy of Oportuns CCPA Notice here:  https://oportun.com/privacy/california-privacy-notice/.
 
We will never request personal identifiable information (bank credit card etc.) before you are hired. We do not charge you for pre-employment fees such as background checks training or equipment. If you think you have been a victim of fraud by someone posing as us please report your experience to the FBI’s Internet Crime Complaint Center (IC3).",2024-01-12,Worldwide,2024-01-12 02:39:33.006755
"Staff Software Engineer, Backend",https://himalayas.app/companies/brightwheel/jobs/staff-software-engineer-backend-8943216930,"Our Mission and OpportunityEarly education is one of the greatest determinants of childhood outcomes is a must for working families and has a lasting social and economic impact. Brightwheel’s vision is to enable high quality early education for every child — by giving teachers meaningfully more time with students each day engaging parents in the development of their kids and supporting the small businesses that make up the backbone of the $175 billion early education market. Brightwheel is the most loved technology brand in early education globally trusted by thousands of educators and millions of families.Our TeamWe are a fully remote team with employees across every time zone in the US. Our team is passionate talented and customer-focused. Our exceptional investor group includes Addition Bessemer Venture Partners Chan Zuckerberg Initiative GGV Capital Lowercase Capital Emerson Collective and Mark Cuban. We believe that everyone—from our employees to the students teachers and administrators we serve— should be given the opportunity to learn and thrive whatever their background may be. We celebrate diversity in all forms because it allows our team and the communities we serve to reach their full potential and do their best work.Who you areWe are seeking a staff software engineer who is well-rounded technically and passionate about the positive impact their code can make in peoples lives. Our Education team is building a new best-in-class learning platform used by admins teachers and parents to support the growth and development of their students and children. You will launch brand new features and products to enable administrators and teachers to plan and deliver engaging and enriching activities document development and share progress with guardians and other stakeholders. At Brightwheel product engineers work closely with product and design as well as with other areas of the business to deliver a platform that meets our teachers’ &amp; parents’ biggest needs.Every engineer at Brightwheel is afforded a high degree of ownership and autonomy. We are a lean fast-moving team and value individuals who can optimize for being impactful while considering both technical and business drivers. You’ll bring a high degree of ownership and ability to execute. What you’ll do
Lead development on our Growth team - help ensure new brightwheel customers have the best possible product discovery onboarding and activation experience.
Work alongside product and design to scope and implement new features or product lines.
Provide input to both delivery and discovery–providing new ideas proposals and constructive criticism to the team.
Be a steward of quality scalability security and performance. Youll work with other engineers to ensure that we have a solid foundation that serves our customers and enables the team to continue building a great product. 
Design and architect new software systems or introduce new technologies as appropriate to support brightwheel’s growth.
Share knowledge and expertise across the engineering team.
Mentor and help to grow the engineering team.
Qualifications Skills &amp; Abilities: 
5+ years of professional experience preferably in fast-paced early- or mid-stage startups
Proficiency in both contributing to and designing APIs using Ruby on Rails or similar technologies
Expertise at writing automated tests (unit/integration/functional)
Expertise in using Git (or VC equivalent)
Experience with 3rd party integrations
Experience with variation testing
Experience with a variety of codebase sizes and ages
Proficiency with AWS or other cloud platforms
Experience with architecting distributed systems for scalability and reliability 
Strong verbal and written communication skills for both technical and non-technical audiences
Experience with microservice or service oriented architectures preferred
Experience with modern webapps like React.js preferred
Experience with Infrastructure as Code (IaC) preferred
Candidates with varying backgrounds are encouraged to apply. We do not require prior knowledge of technologies in our stack only a desire to learn them. At brightwheel you will encounter:
Ruby on Rails
PostgreSQL
Redis
React.js
CircleCI
GitHub Actions
Kubernetes
AWS managed services like Redshift and ECS
Brightwheel is committed to creating a diverse and inclusive work environment and is an equal opportunity employer. All qualified applicants will receive consideration for employment without regard to race color religion gender gender identity gender expression sexual orientation national origin genetics disability age or veteran status.Originally posted on Himalayas",2024-01-12,United States,2024-01-12 02:39:14.434282
Mortgage Loan Portfolio Management Analyst - Senior Associate (Open to Remote),https://himalayas.app/companies/fannie-mae/jobs/mortgage-loan-portfolio-management-analyst-senior-associate-open-to-remote-1012592532,"Company DescriptionAt Fannie Mae futures are made. The inspiring work we do helps make a home a possibility for millions of homeowners and renters. Every day offers compelling opportunities to impact the future of the housing industry while being part of an inclusive team thriving in an energizing flexible environment. Here you will grow your career and help create access to fair affordable housing finance.Job DescriptionAs a valued colleague on our team you will support managing multiple metrics of the Single Family mortgage loan portfolio to meet business and regulatory objectives.  You will be responsible for collecting measuring modeling and analyzing business data to identify problems forecast trend assess impacts and/or make recommendations to improve Single Family portfolio performance as well as provide in-depth research for identifying opportunities for enhanced portfolio management/business efficiency and performance.THE IMPACT YOU WILL MAKEThe Mortgage Loan Portfolio Management Analyst - Senior Associate role will offer you the flexibility to make each day your own while working alongside people who care so that you can deliver on the following responsibilities:
Facilitate the framework development for mortgage loan portfolio optimization incorporate forward-looking views and multi-factor scenario analysis into portfolio management process.
Provide quantitative modeling support to estimate business impacts and identify where portfolio is heading and potential risk and opportunities.
Perform in-depth research on identifying solutions to improve portfolio performance by optimizing across mission return and risk objectives
Support mitigating solutions to achieve portfolio strategy and goals under adverse conditions
Proactively and closely communicate with various internal stakeholders
Facilitate implementing the strategy by delivering business analysis results to executives to empower data-driven decision making
QualificationsTHE EXPERIENCE YOU BRING TO THE TEAMMinimum Required Experience
2 years related experience
Bachelors degree or equivalent
Experience analyzing data to identify trends or relationships to inform conclusions about the data
Skilled in financial modeling interpreting customer and market insights forecasting and benchmarking
Desired Experience
Large financial portfolio management and quantitative modeling experience including Risk/Return Analysis and Financial Markets Analysis Return Optimization and Risk Mitigation Forecasting and Scenario Design Financial Risk Management Pricing and Valuation Analysis and Regulatory Capital Management Skills
Expertise using statistical methods including developing and testing hypotheses using experimental design and running linear and logistic regressions
Skilled in presenting information and/or ideas to an audience in a way that is engaging and easy to understand
3 years of proven track records
Masters degree desired
Skilled in SQL
Skilled in Excel
Skilled in Tableau
Skilled in R or Python programming 
Additional InformationThe future is what you make it to be. Discover compelling opportunities at Fanniemae.com/careers.Fannie Mae is primarily a hybrid company.  We embrace flexibility for our employees while providing office space for in-person work and collaboration.  This role is classified as open to remote. If you speak with a Recruiter they will provide you with more information about the definition of this classification.Fannie Mae is an Equal Opportunity Employer which means we are committed to fostering a diverse and inclusive workplace. All qualified applicants will receive consideration for employment without regard to race religion national origin gender gender identity sexual orientation personal appearance protected veteran status disability age or other legally protected status. For individuals with disabilities who would like to request an accommodation in the application process email us at careers_mailbox@fanniemae.comThe hiring range for this role is set forth on each of our job postings located on Fannie Maes Career Site. Final salaries will generally vary within that range based on factors that include but are not limited to skill set depth of experience certifications and other relevant qualifications. This position is eligible to participate in a Fannie Mae incentive program (subject to the terms of the program). As part of our comprehensive benefits package Fannie Mae offers a broad range of Health Life Voluntary Lifestyle and other benefits and perks that enhance an employee’s physical mental emotional and financial well-being. See more here.Originally posted on Himalayas",2024-01-12,United States,2024-01-12 02:39:14.528673
"Senior Director, Product Design",https://himalayas.app/companies/kiva/jobs/senior-director-product-design,"About us:Kiva is a global nonprofit founded in 2005 with a mission to expand financial access and help underserved communities thrive. Kiva unlocks capital for borrowers through crowdfunded loans supported by individuals around the world. Lenders on Kiva can start with as little as $25 to support causes that matter most to them whether that’s gender equity and support for women refugees climate change small businesses agriculture and more. Since our founding over two million people have invested $1.9 billion in real dreams and real opportunity spanning more than 90 countries and 4.7 million borrowers.As we work toward our mission Kiva invests in building and retaining a global team of talent to add to our values-driven and digital-first culture. Our organization is supported by over 700 volunteers and 130+ full time employees dispersed around the world as well as within team hubs located in San Francisco Nairobi Bogota and Bangkok. Kiva’s team is growing as we pursue exciting new opportunities to scale our impact and create a financially inclusive world.Kivas values:Impact first - This is why we exist. This is the drumbeat we march to. Every day.Extreme ownership - Own it; you your relationships your impact. Insist that others support you and hold you accountable.Be curious and bold - Never stop learning. Question assumptions. Take Risks and dream big.Inclusion. Equity. Diversity. - Without reservation and without caveat. In our hiring in our workplace and in our impact in the world.Honor and integrity - Do the most right thing in the most right way. Cherish diversity and respect each other.Love and kindness always - Say what you mean. Mean what you say. And dont say it mean. Clarity. Courage. Kindness.Role overview:Join a team of product managers designers and technologists who are on a mission to expand financial access to help underserved communities thrive. Building on the success of our crowdlending product we envision a future in which people come together to invest in others who are improving their communities around the world: women refugees small-holder farmers climate-impacted people and underserved communities in the US. We are looking for a Senior Director Product Design who is great at understanding user problems delivering exceptional product experiences and has a passion for building new ways to expand financial access.At this time we can only consider applicants with authorization to work in the United States on a permanent full-time basis; unfortunately we cannot provide visa sponsorship.Key responsibilities include: 
As a player-coach manage and execute multiple projects effectively manage design resources and set clear and measurable goals.
Define your user experience strategy and evolve our UX processes testing methods and design system to deliver exceptional customer experiences.
Embrace and continually improve lean UX approaches to deliver the most value to customers as soon as possible.
Develop and grow your team’s expertise in product design user research interaction design and visual design.
Influence the product roadmap both short term and long term
Build trust up down and across to accelerate your success.
Socialize your strategy and value delivered with key stakeholders.
Core competencies:

Leadership: Ability to inspire and motivate the people around you to deliver positive impacts to the company’s mission and the work environment. Clearly responsible and accountable for your product’s success. Creates the enabling environment to regularly ship products. Leaders emphasize authenticity cooperation and open communication. 

Craft: Demonstrated expertise in two or more user experience disciplines and proven ability to coach and mentor the team on design excellence (visual design interaction design system design research). You have a bias for action and improve how teams deliver by defining processes standards best practices and new ways of collaborating. 

Customer Insights: Ability to frame the right questions evaluate multiple facets of a problem and simulate possible outcomes. Mastery of synthesizing customer insights to inform product decisions. You’re also a coach for the team on applying qualitative and quantitative methods to decision-making. You are skilled at mentoring teams in the process of exploring and converging on valuable feasible solutions. 

Execution: Ability to align people toward a particular objective and orchestrate complex projects. Exercise creativity empathy and persuasiveness – in addition to having superb organization abilities.
Experience: 7 to 9 years as a product designer with at least 3 years in a leadership capacity.
What we offer:
An opportunity to improve real lives solve hard problems and change the world
Friendly supportive and adventurous environment with a team of engaged colleagues
A comprehensive industry-leading benefits package including health dental and vision insurance parental leave professional development 401k matching generous PTO and more.
Opportunities to connect with and learn from colleagues and partners around the world
Salary range: $148K - $246K; a final offer will be dependent upon a candidate’s location skills and experience. 
A diverse and inclusive workplace where we learn from each other is an integral part of Kivas culture. We actively welcome people of different backgrounds experiences abilities and perspectives. We are an equal opportunity employer and a great place to work. Join us and help us achieve our mission!We will only accept applications directly from candidates. Kiva will not be responsible for any recruiting agency fees absent a formal agreement.Originally posted on Himalayas",2024-01-12,United States,2024-01-12 02:39:14.623040
