title,link,description,pubdate,location,timestamp
Temporary Escalations Case Manager,https://himalayas.app/companies/angi/jobs/temporary-escalations-case-manager,"
Angi® is transforming the home services industry creating an environment for homeowners service professionals and employees to feel right at “home.” For most home maintenance needs our platform makes it easier than ever to find a qualified service professional for indoor and outdoor jobs home renovations (or anything in between!). We are on a mission to become the home for everything home by helping small businesses thrive and providing solutions to financing and booking home jobs with just a few clicks.  
Over the last 25 years we have opened our doors to a network of over 200K service professionals and helped over 150 million homeowners love where they live. We believe home is the most important place on earth and are embarking on a journey to redefine how people care for their homes. Angi is an amazing place to build your dream career join us—we cannot wait to welcome you home! 
About the roleAngi is seeking a Temporary Escalations Case Manager for a long-term contract basis to support policy review and definition for our pro and service companies throughout the business based on strategic priorities. As a Temporary Escalations Case Manager you will be responsible for evaluating CX tickets to deduce trends managing pro  customer escalations executing weekly and monthly check refund processing and troubleshooting across cross functional teams.This position will be remote and require candidates to work up to a 40-hour work week and 1 Saturday per month. The hourly rate for this role ranges between $20 - $23 per hour. What you’ll do
Be a resource  problem solver for pro-facing strategic needs  ensure a positive Pro experience (via call email text chat etc.)
Ensure appropriate distribution of jobs review and adjust job volume partner with pros on appropriate and desired growth  expansion explore exclusivity etc.
Professionally follow up with support teams internally and externally ensuring pro need resolution (prioritize top-tier pros continued follow up to ensure resolution etc.
Develop  maintain Pro relationships across all partnerships and territorial areas
Warm handoff between Onboarding / Early Education for newly onboarded pros
Smaller administrative needs as assigned  ad hoc projects
Who you are
Excellent sales negotiation and conflict-resolution skills
Strong escalation management and able to manage numerous parties/situations
Strong written and verbal communication skills (comfort  skill with phone and email)
Comfortable working in systems / learning new tools (Dash Zendesk)
Basic Excel/Google Sheet proficiency
Ability to synthesize data to glean trends  insights
Strong time management  organizational skills
Looker or Tableau experience
We value diversityWe know that the best ideas come from teams where diverse points of view uncover new solutions to hard problems. We welcome and value individuals who bring diverse life experiences educational backgrounds cultures and work experiences.Originally posted on Himalayas",2024-01-12,United States,2024-01-12 02:39:15.334275
"Medical Director, Scientific Affairs",https://himalayas.app/companies/cleerly/jobs/medical-director-scientific-affairs,"
About Cleerly

We’re Cleerly – a healthcare company based in Denver Colorado and New York New York that’s revolutionizing how heart disease is diagnosed treated and tracked. We were founded in 2017 by one of the world’s leading cardiologists and are a growing team of world-class engineering operations medical affairs marketing and sales leaders. We raised $223M in Series C funding in 2022 which will enable rapid growth and continued support of our mission. 
Cleerly is creating a new standard of care for heart disease through value-based AI-driven precision diagnostic solutions with the goal of helping prevent heart attacks. Our technology goes beyond traditional measures of heart disease by enabling comprehensive quantification and characterization of atherosclerosis or plaque buildup in each of the heart arteries. Cleerly’s solutions are supported by more than a decade of performing some of the world’s largest clinical trials to identify important findings beyond symptoms that increase a person’s risk of heart attacks. 
About the OpportunityThe ideal candidate is an MD that has significant prior experience in clinical research including trials and writing as well as clinical experience in the area of cardiovascular medicine and/or cardiovascular imaging and is eager to join a team that is conducting breakthrough science and trials that will reshape the way we think about primary prevention of major cardiovascular events.   About the TeamThe  Scientific Affairs team supports our clinical research and clinical trials within the company. Responsibilities
Clinical Trials 

Sponsor representative towards academic trial leadership partners and contracts; 
Oversight of the conduct progress relationships compliance and budgets of clinical trials 
Overseeing collaborations with cross-functional teams to ensure successful trial execution (Product Regulatory).
Assist in the design of clinical trials leveraging medical expertise to optimize study protocols and objectives; actively write protocols
Regulatory Compliance and Quality: Ensure that all studies conducted adhere to ethical and regulatory standards set forth by the FDA and other relevant governing organizations

Cleerly Core Laboratory - Medical Oversight assist in the design of clinical trials leveraging medical expertise to optimize study protocols and objectives; actively write protocols

Publications and Scientific Writing

Contribute to strategic scientific focus and publication plan for Scientific Affairs.
Lead scientific review process and scientific writing for multiple publications.

Business Development 

Act as a spokesperson for company representing expertise and vision to external stakeholders
Stay up-to-date with scientific publications guidelines market access and regulatory aspects
Drive growth in the clinical trials and research core laboratory business by establishing and nurturing strategic relationships with pharmaceutical biotechnology and medical device companies contract research organizations and other core imaging laboratories. 
Develop and maintain relationships with physicians who will review medical images and serve as advisors for the CTSU core lab fostering a network of trusted experts.

Job duties activities and responsibilities are subject to change by our company.Requirements:
Postgraduate degree MD or PhD
A minimum of 5+ years of clinical trials experience demonstrating a deep understanding of the clinical research process.
Publication record demonstrating excellent skills in scientific writing and leading publication efforts.
 Organizational Skills: Exceptional organizational and time management skills to manage multiple projects simultaneously and effectively.
Communication Skills: Strong verbal and written communication skills including effective presentation abilities. Experience serving as primary author and contributor to peer-reviewed journal articles and presentations at scientific meetings.
Preferred:
Advanced Degree: MPH or PhD preferred showcasing a combination of medical and research business and public health acumen.
Regulatory Expertise: Strong understanding of and the ability to interpret GCP/ICH/FDA standards and guidelines as well as a clear comprehension of internal and external resource management in clinical research.
Salary: $200000-$275000*Total Target Compensation (TTC): Total Cash Compensation (including base pay variable pay commission bonuses etc.). We hire employees anywhere within the United States and account for geography when determining base salary.
OUR CORE VALUES:

We strive to earn trust.
We value and seek out differences.
We obsess over client success.
Our curiosity sparks change.

Why you should apply:


PURPOSE: Cleerly’s purpose is to create a world without heart attacks. With our new paradigm for precision heart care we will leave big footprints in the sands of time. Help us make that a reality!

GROWTH: We prioritize learning and growth. As a rapid growth company there is always space for new challenges and responsibilities.

OWNERSHIP: Everyone on the team contributes to our success so everyone has equity in the company through our employee stock option incentive plan.

BENEFITS: Cleerly offers a variety of medical dental and vision plans designed to fit you and your family’s needs. Along with stock options and a 401(k) match program that helps you invest in the future Cleerly also offers company wide holidays a winter break as well as a self-managed PTO policy. Additional benefits include wellness home office and learning  development stipends and parental leave benefits for new parents.

Don’t meet 100 percent of the qualifications? Apply anyway and help us diversify our candidate pool and workforce. We value experience whether gained formally or informally on the job or through other experiences.
OUR COMPANY IS AN EQUAL OPPORTUNITY EMPLOYER.  We do not discriminate on the basis of race color national origin ancestry citizenship status protected veteran status religion physical or mental disability marital status sex sexual orientation gender identity or expression age or any other basis protected by law ordinance or regulation.
Job duties activities and responsibilities are subject to change by our company.
Recently our name and logo have been used to post fake jobs on job boards without our knowledge. The fake jobs have been removed and we will continue to monitor job boards moving forward and take swift action as needed. Recruiting Fraud is a deceptive practice where individuals pose as recruiters hiring managers or employees of the company. Their goal is to trick candidates into providing personal information (resume social security number bank account information drivers license passport etc). Recruiting at Cleerly: We use Greenhouse as our ATS (Application Tracking System). All open jobs are posted on our Careers page: https://cleerlyhealth.com/careers (if you see a Cleerly job posted on another job board confirm that the job is also posted on our website and apply directly from our Careers Page). All communication from Cleerly will come from our corporate email domain (@cleerlyhealth.com). We do not use other website domain names for emails. All interviews conducted at Cleerly are done via phone call or Zoom. We never text or use chat services to conduct interviews. When you move to the final interview stages at Cleerly you will be contacted by our Senior Talent Partner from our corporate email domain (@cleerlyhealth.com) and receive an offer letter via DropBox Sign We will never ask for bank account information social security number or any other personal information during the interview process. Please reach out to people@cleerlyhealth.com with any questions.
Originally posted on Himalayas",2024-01-12,United States,2024-01-12 02:39:15.429161
