title,link,description,pubdate,location,timestamp
Remote Licensed Mental Health Therapist LMFT LCSW LCMHC,https://himalayas.app/companies/gotham-enterprises-ltd/jobs/remote-licensed-mental-health-therapist-lmft-lcsw-lcmhc-4771163952,"The Clinical Mental Health Professional utilizes clinical expertise to perform psychosocial assessments develop and implement plans of care appropriate care team assess crisis situations to appropriately provide needed resources and or referrals for the patient and provide family and individual treatment as indicated. This position works collaboratively with patients significant other families healthcare providers insurers community resources and all other involved parties. This position provides care appropriate to the established plan of care in the assigned patient population.Related responsibilities of this role include but are not limited to:
Diagnoses and treats various mental emotional and behavioral disorders modifying care plan(s) to reflect changes in patient status
Refers patients to other services to improve their well-being. These referrals may include community services treatment programs support groups psychiatrists or other mental health providers.
Works with the multi-disciplinary team to develop a discharge plan in order to provide further care services and referrals in order to ensure continuity of care. • Complies with federal state local and clinical program/facility standards.
Acts within the scope of the Mental Health Practice Act. • Organizes and prioritizes daily work by assessing new current and discharging patient needs in area(s) of responsibility.
Performs social work consultation for patients and caregivers. Conducts psychosocial assessments. Provides supportive crisis bereavement and other social work interventions as necessary.
Educates communicates and coordinates with multiple patient care teams and outside agencies as necessary to ensure the patient receives quality care and a timely discharge and to identify and resolve delays and issues. Credentialing through medical staff office and peer review requirements may apply if working in the behavioral health setting.
May provide support and debriefing in conjunction with the Employee Assistance Program for staff members following adverse events.
Acts as an advocate on behalf of patients and families where appropriate to ensure effective communication with multidisciplinary care teams outside agencies and other resources as necessary.
May identify patients at risk for potentially avoidable delays extended stay readmission financial or complex discharge needs. Coordinate with care providers and leaders to reach optimal solutions.
RequirementsHow to Qualify:
To be eligible for the role therapists and counselors need to have a Masters degree in Social Work Psychology Marriage and Family Therapy or Mental Health Counseling.
One of the following independent licenses is required: LMFT LCMHC LCSW

Strong computer literacy skills are necessary for the role.
A successful counselor should possess professional evaluation skills decision-making skills and recommendation skills for treatment planning and implementation.
Excellent interpersonal skills and a sympathetic nature are important qualities for a counselor.
BenefitsBenefits
Fully Remote - You Set Your Own Schedule
• Sign on Bonus!!!
Flexible schedule PT/FT Independent Contract
• Bonus with the first client!
Health Insurance Stipend Eligibility for Health Insurance Stipend requires a min
• Work Location: Remote• Pay: $70000.00 - $100000.00 per year• Professional development assistance• Referral program• Choose your own hoursOriginally posted on Himalayas",2024-01-12,United Kingdom United States,2024-01-12 02:39:14.718132
Software Engineer C#,https://himalayas.app/companies/motorola-solutions/jobs/software-engineer-c,"Company OverviewAt Motorola Solutions were guided by a shared purpose - helping people be their best in the moments that matter - and we live up to our purpose every day by solving for safer. Because people can only be their best when they not only feel safe but are safe. Were solving for safer by building the best possible technologies across every part of our safety and security ecosystem. Thats mission-critical communications devices and networks AI-powered video security &amp; access control and the ability to unite voice video and data in a single command center view. Were solving for safer by connecting public safety agencies and enterprises enabling the collaboration thats critical to connect those in need with those who can help. The work we do here matters.
Department Overview
First responders can be in danger at any moment of any day. Whatever the situation public safety operations depend on immediate access to the best information available. Saving time and lives.PremierOne Computer Aided Dispatch (CAD) and PremierOne Records Management System (RMS) incident and resource management system is transforming public safety and dispatch operations. It streamlines the capture correlation and real-time distribution of mission-critical information for improved dispatch decision-making and increased responder awareness and safety.
Job DescriptionAs a C# Software Developer you will work in a Scrum team that co-creates our innovative dispatch solution.At your work you will focus both on new features development as well as on the maintenance of the already released code (we have 70+ customers who trusted our product). We will value your holistic approach to software development where design code implementation and testing are inseparable parts.After the pandemic outbreak the position is fully remote. In the project you will work with the below technologies:ADO.NET WCF .NET Win forms/WPF (C#) SQL Server/SQL express SQL SSIS and SSRS XML/XSLT ASP.NET/IIS JSON Visual Studio
Basic RequirementsYou will need experience in:
Practical knowledge of C#/.NET development ecosystem
Practical knowledge of one of the following technologies (at least on a basic level): C++ SQL/T-SQL ASP.NET MVC
Nice to have knowledge: MFC library MEF Appium NUnit Nsubstitude MSTest NHibernate
English language skills at a level allowing efficient communication
Understanding Agile and willing to work this way
In return for your expertise we’ll support you in this new challenge with coaching &amp; development every step of the way. Also to reward your work you’ll get:
Private medical coverage Multisport
Life insurance (two annual income) 
Employee Stock Purchase Plan – 15% discount for buying Motorola’s Stock units 
Employee Pension Plan – 35 % of the month’s salary gross which goes to the retirement account
IP Tax Relief (up to 80%)
Yearly salary increase (depends on individual performance)
Yearly bonus (depends on company performance)
Flexible working hours (usually day starts between 7-10) 
8 hours working day (30 minutes lunch break included).
Hybrid/ remote work

Travel RequirementsUnder 10%
Relocation ProvidedDomestic
Position TypeExperiencedReferral Payment PlanYesCompanyMotorola Solutions Systems Polska Sp.z.o.oOriginally posted on Himalayas",2024-01-12,Poland,2024-01-12 02:39:14.828179
Copy of Condition Monitoring Engineer,https://himalayas.app/companies/assetwatch/jobs/copy-of-condition-monitoring-engineer,"AssetWatch serves global manufacturers by powering manufacturing uptime through the delivery of an unparalleled condition monitoring experience with a passion to care about the assets our customers care for every day. We are a devoted and capable team that includes world-renowned engineers and distinguished business leaders united by a common goal – To build the future of predictive maintenance. As we enter the next phase of company growth we are seeking dynamic people to help lead the journey. The primary function of the Condition Monitoring Engineer is supporting the company’s unique value proposition by generating high quality and actionable data and information for its industrial customers. This role works closely with product development installation and customer support teams as well as customers’ reliability engineers.Duties/Expectations
Collect and analyze vibration and temperature data at client sites customizing data processing to the client’s asset and determining if maintenance is needed
Perform vibration data collection data analysis software modeling and programming and engineering evaluations
Evaluate machinery health and condition through detailed analysis of vibration data
Develop software modelling and programs to maintain and expand vibration data analysis library to improve ability to process data
Provide high-quality actionable information to clients (e.g. setting appropriate alarm levels within the analytical tools to alert customers of pending failures).
Accompany hardware installation team and recommend placement of machine condition sensing units.
Lead and grow AssetWatch predictive maintenance (PdM) tool develop program
Expand AssetWatch expertise in machine condition monitoring beyond vibration analysis to include ultrasonic analysis oil/fluid analysis
Work closely with the product development team to create high-valued hardware and software solutions and expanded product offerings
Requirements
Minimum of five years of relevant experience with vibration data collection and analysis ideally using FFT analyzers and predictive/preventative maintenance software. (Must demonstrate technical competence.)
Valid ISO Category II or higher vibration certification preferred. Continued certification expected.
Strong understanding of electro-mechanical fundamentals including AC induction and DC motors
Strong mechanical background with industrial equipment - centrifugal and reciprocating compressors turbines blowers pumps gearboxes hydraulics pneumatics etc.
Proficient with the operation of one or more analyzers measuring vibration spectra and time waveforms.
Proficient with developing optimum corrective actions based on findings of acquired field vibration analysis data observations and discussions with key plant personnel.
Must be able to work on and around elevated fixed and rotating equipment
Proficiency with Microsoft Office Suite and standard PC applications.
Good communication and interpersonal skills
Desire to work in a “startup” environment and have a “startup” mentality – work collaboratively with others across all levels of the organization; resolve obstacles that may prevent the organization from achieving its mission; wear many hats as needed
Be customer focused - demonstrate the desire and knowledge to understand customer needs; provide personalized professional service accurate information and continuous communication
Demonstrate integrity - behave ethically act fairly and take responsibility for accomplishing work
Preferences
Engineering Degree
Experience or interest in computer programming and simulation software (e.g. MATLAB LabVIEW)
What We Offer:AssetWatch is a remote-first rapidly growing startup providing a game changing condition monitoring platform and mobile experience in the industrial manufacturing space.
Competitive compensation package including share options.
Flexible work schedule
Full benefits and 401K
Opportunity to make a real impact every day
Opportunity to work with an exciting and growing team
Unlimited PTO
We have a distributed team that works remotely across locations in the United States. We are open to candidates from most states but collaboration within core working hours is required.Originally posted on Himalayas",2024-01-12,United States,2024-01-12 02:39:14.908132
Recruiting Coordinator [Contract to Hire],https://himalayas.app/companies/grow-therapy/jobs/recruiting-coordinator-contract-to-hire,"
About us: 
Grow Therapy is on a mission to serve as the trusted partner for therapists growing their practice and patients accessing high-quality care. Powered by technology we are a three-sided marketplace that empowers providers augments insurance payors and serves patients. Following the mass increase in depression and anxiety the need for accessibility is more important than ever. To make our vision for mental healthcare a reality we’re building a team of entrepreneurs and mission-driven go-getters. Since launching in February 2021 we’ve empowered over ten thousand therapists and hundreds of thousands of clients across the country and insurance landscape. We’ve raised over $100mm of funding from Transformation Capital TCV and SignalFire. 
What youll be doing: We are seeking a strong recruiting coordinator to be the point person for all of our interview scheduling. If you are highly organized efficient and have experience with interview scheduling we would love to chat! 
Youll be a constant companion for each candidates journey through the hiring process from start to finish.
Youll coordinate all of our recruiting activities with candidates and correspond with them in a warm helpful and friendly tone whether it be via email voice or video.
Youll schedule all interviews for Grow Therapy including hiring manager interviews final round interviews and any supplemental rounds after that. 
Youll work to ensure our applicant tracking system is the single source of truth and that all the data is correct. 
Youll proactively iterate to ensure the candidate experience is high-touch empathetic and organized with no candidate being dropped.
This role is a 10 week contract-to-hire. The rate for this contract is $30/hr. You’ll Be a Good Fit If: 
You have 2+ years of experience performing in a recruiting coordinator role 
You are extremely organized and highly efficient at multitasking 
You have experience scheduling interviews using an ATS preferably greenhouse 
You have experience with application review and moving candidate through an ATS preferably greenhouse 
You are energized and excited about being Grow’s first recruiting coordinator! 
If you don’t meet every single requirement but are still interested in the job please apply. Nobody checks every box and Grow believes the perfect candidate is more than just a resume. 
Benefits

The chance to drive impact within the mental healthcare landscape from day one
Comprehensive health insurance plans including dental and vision
Our dedication to mental health guides our culture. Wellness benefits include (but are not limited to):

Flexible working hours and location (remote OR in-office your choice!)
Generous PTO 
Company-wide winter break 
Mental health mornings (2 hours each week)
Team meditation
Wellness Stipend
In-office lunch and biweekly remote lunch on us! 

Continuous learning opportunities 
Competitive salary 
The opportunity to help build a rapidly scaling start-up organization by taking strong ownership of your work mentorship and our unbounded leadership opportunities 

Grow Therapy is proud to be an equal opportunity workplace and is an affirmative action employer. We are committed to equal employment opportunity regardless of race color ancestry religion sex national origin sexual orientation age citizenship marital status disability gender identity or Veteran status. We also consider qualified applicants regardless of criminal histories consistent with legal requirements.
Originally posted on Himalayas",2024-01-12,United States,2024-01-12 02:39:15.018754
Accounting Specialist/Redovisningsspecialist,https://himalayas.app/companies/vattenfall/jobs/accounting-specialist-redovisningsspecialist,"FöretagsbeskrivningVattenfall är en av Europas största producenter och återförsäljare av el och värme. Våra huvudmarknader är Sverige Tyskland Nederländerna Danmark och Storbritannien. Inom Vattenfallkoncernen finns cirka 20 000 anställda. Vi har elektrifierat industrier levererat energi till bostäder och förvandlat tillvaron genom innovation i över hundra års tid. Vi vill nu göra det möjligt att leva fossilfritt inom en generation och vi driver på övergången till ett hållbart energisystem.JobbeskrivningÄr du en redovisningsekonom som vill kombinera affärsmässighet med ledarskap? Drivs du av att ständigt förbättra rutiner och leverera resultat? Då har vi jobbet för dig!Nu söker vi en Accounting Specialist/ Redovisningsspecialist till Vattenfall Finance Business Support i Solna. Accounting R2R (Record to report inom General Accounting) är den funktion inom Finance Business Support som tillhandahåller redovisningsexpertis till bolagen inom Vattenfall med högt fokus på kvalitet och efterlevnad av redovisningsregler. Accounting R2R är därmed experter på IFRS och legala regler förbereder bokningar driver boksluten och den externa revisionsprocessen rapporterar till Vattenfall koncernen och sammanställer årsredovisningar.Funktionen Accounting R2R är organiserad per land. Delar av den löpande redovisningen och rapporteringen inom Accounting R2R är outsourcad till Capgemini och en av huvuduppgifterna blir därmed att säkerställa alla leveranser och optimera processen i samarbete med vår outsourcing partner.Några av dina uppgifter som Accounting specialist/ Redovisningsspecialist hos Accounting R2R är att operativt säkerställa att huvudboken hanteras enligt Vattenfalls krav. Du kommer också att leda den externa revisionsprocessen samt bistå med redovisningskompetens när det behövs. Det innebär t. ex. att beräkna avsättningar och periodiseringar och göra årsredovisningar för ett eller flera bolag. Som specialist kommer du utöver det också att bistå i komplexa redovisningsärenden utveckla instruktioner för nya redovisningsprinciper delta i att utbilda och utveckla personal i komplexa redovisningsfrågor diskutera och samordna med Group accounting och de externa revisorerna i samråd med kollegorna i teamet.Processerna inom ekonomiområdet genomgår ständiga förändringar så också på Vattenfall vi vill därför erbjuda rätt personer stora möjligheter att definiera sin egen framtid inom redovisning och hos oss på Vattenfall.Kvalifikationer
Relevant universitetsutbildning (civilekonom) eller jämförbar annan utbildning• 3-5 års erfarenhet av arbete med redovisning och legal rapportering i en komplex organisation• Goda kunskaper om gällande redovisningsregler (IFRS och legal redovisning K2/ K3)• Goda kunskaper om processer som tillämpas inom ekonomiområdet och specifikt inom redovisning och bokslutsrapportering• Stort intresse och kunskap om IT-baserade rapporteringssystem och god kunskap om IT generellt• Meriterande att ha erfarenhet från storföretag
Personliga egenskaperDu är en person som gillar redovisning och är trygg i din roll och med att stötta och vägleda andra inom området. Att samarbeta är enkelt för dig men du kan också arbeta självständigt och proaktivt när det behövs. Du trivs i föränderliga miljöer och ser dig själv som en lösningsorienterad person som tycker om att effektivisera och förbättra rutiner och arbetssätt. Du är en effektiv kommunikatör med en god förmåga att uttrycka dig i både tal och skrift på både svenska och engelska. Ytterligare informationPlaceringsort: SolnaVi välkomnar din ansökan med CV och personligt brev på svenska senast den 4 februari. Urval och intervjuer sker efter sista ansökningsdag.För mer information om tjänsten är du välkommen att kontakta anställande chef Anders Jarelöv anders.jarelov@vattenfall.com. För mer information om rekryteringsprocessen är du välkommen att kontakta rekryterare Catalina Roa Rodriguez catalina.roarodriguez@vattenfall.com.Fackliga representanter för denna tjänst är Rolf Ohlsson (Akademikerna) Inger Strandberg (Unionen) Christer Gustafsson (Ledarna) Lennart Bengtsson (SEKO). För att komma i kontakt med representanterna ring Vattenfalls växel: 08 739 50 00.Vi är övertygade om att mångfald bidrar till att bygga ett mer lönsamt och tilltalande företag och strävar efter att vara goda förebilder när det gäller mångfald. Vattenfall arbetar aktivt för att alla medarbetare ska ha samma möjligheter och rättigheter oavsett ålder etnisk eller kulturell bakgrund könstillhörighet religion/tro sexuell läggning eller funktionsförutsättning. Läs mer om hur vi arbetar med mångfald och inkludering här. Vattenfall är en del av Sveriges kritiska infrastruktur därmed är många av våra tjänster säkerhetsklassade. Är denna tjänst säkerhetsklassad kommer säkerhetsprövning genomföras innan anställning i enlighet med säkerhetsskyddslagen.  Originally posted on Himalayas",2024-01-12,Sweden,2024-01-12 02:39:15.128092
Cloud - Fullstack Engineer,https://himalayas.app/companies/elastic/jobs/cloud-fullstack-engineer-51489643,"Elastic is an open source search company that powers enterprise search observability and security solutions built on one technology stack that can be deployed anywhere. From finding documents to monitoring infrastructure to hunting for threats Elastic makes data usable in real time and at scale. Thousands of organizations worldwide including Barclays Cisco eBay Fairfax ING Goldman Sachs Microsoft The Mayo Clinic NASA The New York Times Wikipedia and Verizon use Elastic to power mission-critical systems. Founded in 2012 Elastic is a distributed company with Elasticians around the globe. Learn more at elastic.coThe Control Plane IAM team owns everything related to authentication and authorization in the Elastic Cloud offering. Our globally distributed team is highly skilled and has deep experience in the security area there is plenty of room to be a mentor to be mentored to lead new features and to advance both technically and professionally in this challenging and ever-evolving space.Given the critical nature of our work the teams core tenets are correctness maintainability stability and supportability. As the layer that verifies user identities and ensures that answers to what users can do are correct we place the highest value on accuracy to ensure no privilege escalation. The services we manage need to be stable and reliable. We take time to test functionality scale and behavior during failure. By doing so we can understand when things will hit a breaking point and proactively stay ahead of potential issues. Does this sound like you?What You Will Be Doing:
You will innovate lead and contribute to the development and user experience of both our hosted and on-premise offerings
You will work closely with the Elastic Cloud Product Operations and Engineering teams to define and shape the tasks we work on
Assist in designing a scalable cloud offering to work across everything from a few Elasticsearch clusters and Kibana instances to many thousands
Use your frontend expertise to help design clear and simple APIs
What You Bring Along:
You care deeply about the design and quality of the features you ship
2+ years working as a fullstack engineer
Good JavaScript knowledge as well as other web technologies
Knowledge of at least one backend programming language such as Go or Scala.
Dedication to writing unit integration and end-to-end tests
Strong communication and problem-solving skills
Ability to work autonomously in a globally distributed team
TypeScript and React experience is a plus
Scala experience is a plus

Additional Information - We Take Care of Our People
As a distributed company diversity drives our identity. Whether you’re looking to launch a new career or grow an existing one Elastic is the type of company where you can balance great work with great life. Your age is only a number. It doesn’t matter if you’re just out of college or your children are; we need you for what you can do.
We strive to have parity of benefits across regions and while regulations differ from place to place we believe taking care of our people is the right thing to do.

Competitive pay based on the work you do here and not your previous salary
Health coverage for you and your family in many locations
Ability to craft your calendar with flexible locations and schedules for many roles
Generous number of vacation days each year
Double your charitable giving - We match up to $1500 (or local currency equivalent)
Up to 40 hours each year to use toward volunteer projects you love
Embracing parenthood with minimum of 16 weeks of parental leave

Different people approach problems differently. We need that. Elastic is committed to diversity as well as inclusion. We are an equal opportunity employer and committed to the principles of affirmative action. Qualified applicants will receive consideration for employment without regard to race color religion sex sexual orientation gender perception or identity national origin age marital status protected veteran status or disability status or any other basis protected by federal state or local law ordinance or regulation. If you require any reasonable accessibility support please email candidate_accessibility@elastic.co.
Applicants have rights under Federal Employment Laws view posters linked below:Family and Medical Leave Act (FMLA)Poster; Equal Employment Opportunity (EEO)Poster; andEmployee Polygraph Protection Act (EPPA)Poster.
Please see here for our Privacy Statement.
Originally posted on Himalayas",2024-01-12,Worldwide,2024-01-12 02:39:15.223654
