title,link,description,pubdate,location,timestamp
Subject Matter Expert - English Composition,https://remotive.com/remote-jobs/all-others/subject-matter-expert-english-composition-1885080,"iDesign is currently looking for a qualified subject matter expert who is experienced in developing engaging online content that aligns with the Texas General Education Core Curriculum standards for English Composition to join our course development team. SME assignments are contract positions that are part-time temporary on an as-needed basis only. The SME is a remote project-based 1099 contractor position. We are not able to guarantee any full-time positions as a SME. The opening is for current project needs. Contractors must be able to work daytime weekday hours in the Central time zone. Are you that person?
What Youll Do 
As the Subject Matter Expert (SME) you will work collaboratively with others on designing learning content assessments and other additional resources as needed. You will work closely with several team members including iDesign leadership Learning Architects (instructional designers) Learning Technologists Quality Reviewers and Copy Editors (and possibly other SMEs) to ensure the design and development of online learning support the partners vision. You will also work with the Lead Learning Architect/Project Manager to inform them of issues that impact course design development and delivery of the project. SME involvement in a project will be variable based on the workload and your availability.
The successful candidate will work remotely on a contract basis. iDesign recognizes that a quality workforce is paramount to our success. 
You will:
Collaborate with Learning Architects and SMEs to design superior online courses supported by research-based best practices in online learning.Establish learning outcomes and alignment of content and assessment to those learning outcomes.Design relevant assessments that align with course learning objectives.Identify relevant open educational resources and appropriate instructional methods for online content delivery.Work with Lead Learning Architect/Project Managers to ensure all deadline dates are met throughout the design and development process.

What You Need to Get the Job Done
Masters degree required Ph.D. preferred in English.3 to 5 years of curriculum development experience preferably within higher education though high school is acceptable.Strong interpersonal skills and a history of positive results achieved collaboratively.Commitment to the project from start to completion.Ability to work collaboratively in Google Drive and Docs. Ability to design and develop high-quality learning content assessments and modules based on specific project guidelines.Available to meet regularly during the week with a Learning Architect (LA) during the design and development stages.Ability to work independently between working meetings with LA and complete action items as identified throughout the process.
What Will Make Us REALLY Love You
You establish a collaborative and collegial relationship with teammates while moving projects forward and meeting project deadlines.You have experience utilizing adult learning theory and andragogy/pedagogy to support course development.You have strong organizational skills excellent follow-through and exceptional attention to detail.You possess excellent oral/written communication and presentation skills.
This position is not open to applicants residing in or otherwise based in the State of California. 
",2024-01-12,USA,2024-01-12 00:09:02.478472
Data Research Analyst - SMB,https://remotive.com/remote-jobs/data/data-research-analyst-smb-1883275,"
Company Description
At Marketplace our mission is to help readers turn their aspirations into reality. We arm people with trusted advice and guidance so they can make informed decisions they feel confident in and get back to doing the things they care about most.We are an experienced team of industry experts dedicated to helping readers make smart decisions and choose the right products with ease.
Marketplace boasts decades of experience across dozens of geographies and teams including Content SEO Business Intelligence Finance HR Marketing Production Technology and Sales. The team brings rich industry knowledge to Marketplace’s global coverage of consumer credit debt health home improvement banking investing credit cards small business education insurance loans real estate and travel.

Job Description
 
We are seeking an SMB Data Analyst to join our team and assist our editorial team in creating top-quality content. In thisrole you will provide competitive analysis on the market and ensure the quality and accuracy of data collection and analysis for products and services relevant to SMBs with a focus on software.
Your research and analysis will be a key component of making trustworthy relevant assessments of products and services and will help thousands of SMBs make informed decisions about the products and services they use. 
Responsibilities:

Review editorial data requests for feasibility usability and scalability
Leverage a team of in-house Data Researchers based to collect product and service data with a focus on products for SMBs
Perform analysis on collected data to identify top-quality products and services for SMBs
Develop and implement processes for quality control
Collaborate with peers to introduce and develop new techniques and processes for efficient data collection
Collaborate with the editorial team to ensure deadlines and goals are met
Review editorial content resulting from work product for accuracy and completeness

About You:

Highly organized with strong attention to detail and critical thinking abilities
Comfortable working in G-Suite with an emphasis on Google Sheets
Strong analytical and problem-solving skills
Ability to adapt to a changing environment and prioritize projects accordingly
Previous experience in a quality role is preferred
Comfortable managing your own projects and deliverables

Requirements: 

Associates Degree or Certificate in a relevant field such as business or computer science or equivalent training and experience
Proficiency in using Google Sheets for data analysis and manipulation
Proven experience in software testing as well as proficiency in SQL and Python for data manipulation are desirable

Benefits:

Unlimited PTO (35 days minimum)
Every third Friday of the month off
Winter break closure; the week between Christmas and New Years
Home office setup
Wellness Reimbursement (up to £60 a month)


Qualifications

Additional Information
Forbes Marketplace provides equal employment opportunities to all employees and applicants for employment and prohibits discrimination and harassment of any type without regard to race color religion age sex national origin disability status genetics protected veteran status sexual orientation gender identity or expression or any other characteristic protected by federal state or local laws.
This policy applies to all terms and conditions of employment including recruiting hiring placement promotion termination layoff recall transfer leaves of absence compensation and training.
#LI-REMOTE #LI-NM1
",2024-01-12,UK,2024-01-12 00:09:02.556872
Multilingual Executive Assistant,https://remotive.com/remote-jobs/business/multilingual-executive-assistant-1884858,"Multilingual Executive Assistant - Remote - $24000/yr
Watch this first!
About WeAssist:
WeAssist founded by Reef Colman just four years ago is nothing like other staffing agencies; were a dynamic recruiting firm dedicated to creating equally advantageous opportunities in the world of business. With a team of over 75 members we bridge the gap between American companies seeking quality talent and skilled professionals around the globe in need of reputable and stable employers. What sets us apart is our unwavering commitment to our people offering comprehensive benefits skill development personal growth community involvement prizes and a commitment to making a positive impact by supporting initiatives like building schools feeding the homeless and advancing education. Join us at WeAssist where outsourced professionals thrive!
About the company we are hiring for:Our client is a dynamic digital marketing agency specializing in transforming the restaurant industry. The founders are seasoned digital marketing experts the company boasts a decade of experience in the field and an impressive seven years of exclusive focus on the unique demands of the restaurant sector. The companys journey began in 2016 when the founders recognized a significant gap in the market: the absence of innovative digital marketing strategies to fuel the growth of restaurants.
The company has been experiencing significant growth over the past few years and is still growing. They currently have a headcount of 45 with 12 team members offshore. They are forecasting a $6 - $7 million revenue this year alone.
Our clients core values:

Own your outcome

We take ownership of our actions and outcomes refusing to blame others or make excuses. Its okay to not hit metrics occasionally but we should always know why we didnt hit them and have a game plan around getting back on track. We embrace responsibility and hold ourselves accountable for our performance.

Unimpeachable character

Be the type of person with whom people are always proud to associate personally and professionally.

Create the “Wow” factor

We always ask ourselves “Will this impress our clients enough to tell someone about it?” We put forth our best effort every day to deliver exceptional work. If were not “WOW”ing our clients were not doing everything we can to help them succeed.

Swift action

We approach every situation with our clients and colleagues with a high sense of urgency. Our clients trust us as an integrated part of their business. We want to make them feel like were part of their team always ready to support their business needs.
Mission of Executive Assistant:The mission of the Executive Assistant is to provide unwavering support and efficiency to the company CEO dedicated to enabling their success by seamlessly managing administrative tasks streamlining processes and enhancing their productivity. 
The Executive Assistant will be an indispensable partner enabling the CEO to excel in his role steer the organization to success and focus on their strategic vision contributing to the overall growth and prosperity of the organization. 
This is a good fit for you if:

You can speak English and Spanish (bonus if Portuguese too)
You have a proven work experience as an Executive Assistant

Booking calls
Arranging travel
Making reports
Managing emails


You have experience in project management
You are not shy to speak up and be assertive
You have experience working in the restaurant industry (bonus)
You have design experience (bonus)
You are extremely reliable
You are an active listener
You are detail oriented
You want to be the best

You are hungry to win!



This is NOT a good fit for you if:

You are not bilingual 
You are timid and shy
You do not have assistant or relevant experience
You do not know how to be assertive when needed
You do not have access to strong wifi
You do not show up consistently on time
You do not take your job seriously

Perks:

Health insurance
Dental insurance
Mental health insurance
Great starting salary
Growth opportunity

The skys the limit. To name a few potential for salary increases potential shifts and responsibilities as you grow eg.  managing a team.


Prizes and bonuses 

Specifics:Time 

Full time
EST US time zone
This is a remote position so you can have the freedom to work from anywhere
You need to work at the same time with the team for better collaboration.

 

Miscellaneous

Attire - business casual when on meetings
Professional setup

Clean background
Good camera
Good microphone 
Strong wifi





 

Compensation

$24000/year



 
Expectations for Performance:
In your first 30 days on the job:
In your first 30 days of employment the CEO will be training you personally. You will be meeting with him via video call very frequently. They also have some training videos available for you to go over and learn what each teams tasks and responsibilities are.
Outcomes // KPIS:
 

Calendar Management Efficiency:


Number of scheduling conflicts or overlaps.
Percentage of meetings scheduled on time.


Email and Communication Management:


Response time to emails and messages.
Percentage of urgent emails handled promptly.


Task Completion and Priority Management:


Percentage of tasks completed on or before deadlines.
Accuracy in prioritizing tasks and meeting high-priority needs.


Meeting Preparation:


Time spent on agenda preparation for meetings.
Feedback on the quality and comprehensiveness of meeting materials.


Travel and Itinerary Management:


Number of travel-related issues or disruptions.
Efficiency in organizing travel plans and itineraries.


Task Delegation and Follow-up:


Percentage of tasks delegated to appropriate team members.
Timeliness and effectiveness of follow-up on delegated tasks.


Team Collaboration:


Contribution to a positive team environment.
Feedback from colleagues on collaboration and support.


Project Management


Monitor and track project progress.
Compile reports and create monthly keynote presentations.

Qualifications:

Possesses good communication skills 

Great English and - written and orally
Can speak Spanish and Portuguese (bonus)


Proven experience as a Executive assistant
Project management experience
Proficiency with ChatGPT (a plus)
Familiarity with ClickUP (bonus)
Experience with Hubspot (bonus)
Experience using project management tools; e.i. ClickUp
Experience working for a design agency is a huge plus

",2024-01-12,Brazil,2024-01-12 00:09:02.635694
Implementations Consultant - Payroll,https://remotive.com/remote-jobs/finance-legal/implementations-consultant-payroll-1884664,"As a PaySpace Payroll Implementation Consultant your primary responsibility is to execute the successful implementation and support of cloud payroll implementation for new and existing customers on PaySpace. Your expertise in technical payroll implementations is crucial to meet the specific needs of our customers.
Key Responsibilities:
Payroll Implementations: Lead Customer Workshops and Stakeholder Management: Actively lead workshops demonstrating confidence in addressing senior and executive management while effectively managing stakeholder expectations.Payroll Expertise: Ensure knowledge is current by continuously monitoring and ensuring understanding of fact sheets for areas of accountability to ensure compliance with the relevant countrys requirements when implementing.Payroll Blueprint Compilation System Configuration and Stakeholder Management: Critically analyse and document customer requirements to ensure the best solutions are offered and then configure the system according to the agreed customers requirements all while proactively managing stakeholder relationships. Analyse and make recommendations on customer payroll blueprints to ensure the most efficient and compliant payroll setups are in place.Data centric: Expertly migrate data from the customers current system to PaySpace ensuring the accuracy and balance of payroll data applying advanced data analysis and reporting skills to ensure payroll implementations. Proficiency in data modelling advanced functions and complex data analysis techniques is essential.Collaboration: Brainstorm with the development and implementations manager to best fulfil new requirements and create specification documents for these customizations.Customer Support: Build lasting relationships with customers through you customer centric approach offering support to customers after implementation and ensuring a smooth handover to the support or outsourcing department.Functionality Testing: Thoroughly test new system functionality following the prescribed testing process and collaborate with internal teams and customers to ensure timeous and effective functionality is implemented.Stay Informed: Stay up to date with the latest system functionality to provide the most relevant support to customers.Cross-Departmental Assistance: Assist the support and outsource departments with queries as needed.Mentoring: Mentor and guide new/junior consultants on the implementation process and system functionality.
Requirements:
Payroll and HR Knowledge: Full knowledge of payroll and HR legislation covering relevant regulations.Africa Expertise: Experience with African country legislation.Experience: A minimum of 7 to 12 years experience in a similar role at a senior level demonstrating proficiency in systems thinking problem solving and technical payroll analysis skills. This includes advanced Excel skills for data analysis and reporting.Accounting Skills: Demonstrated experience with accounting principles.Project Management: Proven project management experience.Technical Proficiency: Advanced skills in the Microsoft Office suite including Excel and Word. Proficiency in data modelling advanced functions and complex data analysis techniques is essential.Analytical Skills: Strong analytical abilities to solve complex problems.Innovative: A creative and innovative mindset to adapt to new situations.Quick Learner: Demonstrated ability to learn and apply technical concepts.Interpersonal Skills: Strong interpersonal skills to effectively work with customers and colleagues.BI Experience: Experience with QlikView or similar Business Intelligence tools is a plus.Advanced Excel skills: Your advanced Excel skills for data analysis and reporting are essential and they will be a critical part of your role in technical payroll analysis and problem-solving. 
PaySpace is buzzing with excitement as we embark on an extensive recruitment drive and were on the hunt for the crème de la crème of Payroll systems experts. Given our lightning-fast expansion well be onboarding new talent in the upcoming one to six months. If you bring any of these skills to the table and share our enthusiasm for becoming a part of the native cloud-based Payroll and Human Capital Technology company were eager to get to know you! 
",2024-01-12,South Africa,2024-01-12 00:09:02.714208
DevOps Engineer (OBRIO),https://remotive.com/remote-jobs/devops/devops-engineer-obrio-1884588,"OBRIO is an IT company with Ukrainian roots inside Genesis business ecosystem. Our team consists of more than 120 talented professionals whose ambitions and striving for success help us build the best products on the market. Currently the OBRIO team works remotely from various locations in Ukraine and 12 other countries. We have offices in Kyiv and Warsaw.We are developing Nebula – the biggest brand in the astrology niche. Nebula has over 30 million users worldwide and has been ranked as the № 1 lifestyle app of the day in the Apple Store and Play Market in the USA Canada and Australia several times. Nebula is available on iOS Android and Web. Also Nebula is the top 1 astrological brand in the USA and Canada according to Facebook Brand Audit.
Our mission is to make people happier by improving the quality of their relationships. Here are some details we would like to share with you:
Nebula is #1 in its niche in terms of downloads and revenue targets;30+ million downloads;Users from 50+ countries;4.8 - our average AppStore rating (with more than 215 thousand ratings)
Now we are actively looking for a DevOps Engineer to join our Nebula tech team and make a lasting impact on our dynamic and innovative projects. Your role will be instrumental in shaping the future of our infrastructure ensuring seamless development deployment and security.
Your Impact:
Develop and Support Multi-Project Environment: Lead infrastructure development in a scalable multi-project setting ensuring our technology scales seamlessly.Infrastructure Planning Development and Testing: Collaborate with cross-functional teams to plan develop and test cutting-edge infrastructure solutions.Create and Maintain CI/CD Pipelines: Design and deploy pipelines to ensure a fast and efficient transition from development to deployment.Automation Implementation: Drive automation implementation across the board enhancing efficiency and reducing manual intervention.Ensuring Security: Employ best security practices safeguarding our infrastructure data integrity and compliance.Systems troubleshooting and problem-solving: Dive into system troubleshooting and contribute to creative problem-solving. Scheduled On-Call availability (Emergency only): Ensure reliable tech by being on-call for critical situations minimizing downtime.
Knowledge and skills that will help you succeed in this position:         
 Minimal working experience: 2+ years as DevOpsMust have:Be familiar with:Linux (Storage/Network/Process Management etc.)Networking fundamentals (switching routing load balancing names resolution etc.) and so onCLI and Scripting (Bash/Python)Configuration Management Systems (Ansible)Continuous Integration/Delivery/Deployment conceptsGood experience with:Logging and monitoring systems.RDMS (MySQL/PostgreSQL)NoSQL (ElasticSearch MongoDB)Version Control System (Git)IaC approach tools (Terraform)Docker containers (images containers and registries)CI/CD SolutionsFrameworks like: laravel yii symphony etc. (also non php incl.)Managing complex AWS environments (EC2 S3 IAM Lambda Route53 VPC Load Balancers DynamoDB etc. )Understanding of: Distributed Systems concepts High Availability and scaling typesSDLC models. Agile/Scrum/Kanban or hybrid modelsNice to have:Containers Orchestration (Kubernetes AWS ECS Swarm etc.)Variety systems performance analysis skill.Security backgroundPublic GitHub accountIntermediate English level(Reading/Writing at least)
Our technology stack :
AWS DigitalOcean GCPDebian Linux + Amazon Linux(RHEL compatible)Terraform AnsibleGrafana+OpsgeniePrometheus StackElastic StackRabbitMQphp+nginxnodejs+traefikmysql postgresql redisGitlab Gitlab-CIJira SlackKubernetes
Why OBRIO is the best place to work?
Unleash Your Ambitions: Our company was built by ambitious people who never settle for less. By joining OBRIO youll have the chance to unleash your own ambitions and achieve your career dreams.We dont just give you opportunities for growth and development we give you maximum autonomy and believe we cant do without you and your active thinking.Here youll be part of the product creation process from discussing ideas to implementing and testing cool product solutions in real life.Collaborate in a Team Environment: We believe that success is a team effort. When you join OBRIO youll have the chance to collaborate with talented individuals who share your passion for achieving outstanding results.At OBRIO weve gathered influential experts all of whom are open to sharing their knowledge and ready to help solve issues based on their experience. This is the company where you can quickly reach your potential and advance your career.
Our benefits:
Benefit from the flexibility to work from anywhere in the world;Work from the comfort of your home or from one of our offices in Kyiv or Warsaw. The choice is yours!Enjoy 20 annual vacation days and unlimited sick leave all covered by the company;Dont worry about getting the right equipment weve got you covered if necessary;Stay healthy with access to a corporate doctor online and health insurance options in Ukraine or a fixed amount towards insurance abroad after your probation period;Keep learning with our extensive corporate library internal online meetings and lectures;Grow your skills with our training compensation program;Take advantage of our supportive corporate culture including assistance with relocation advice on legal stay abroad housing support and help for third-country nationals;Have fun with our online events and team-building activities
Heres what our hiring journey looks like: Initial Screening ➡ Team Interview ➡ Optional Skill Assessment ➡ Final Check ➡ Job Offer.
Lets team up and reach for the stars together!
More about us on social media: Facebook Instagram LinkedIn TikTok.
",2024-01-12,Ukraine,2024-01-12 00:09:02.777101
