title,link,description,pubdate,location,timestamp
Staff AI Platform Architect,https://himalayas.app/companies/servicenow/jobs/staff-ai-platform-architect,"Company DescriptionAt ServiceNow our technology makes the world work for everyone and our people make it possible. We move fast because the world can’t wait and we innovate in ways no one else can for our customers and communities. By joining ServiceNow you are part of an ambitious team of change makers who have a restless curiosity and a drive for ingenuity. We know that your best work happens when you live your best life and share your unique talents so we do everything we can to make that possible. We dream big together supporting each other to make our individual and collective dreams come true. The future is ours and it starts with you. With more than 7700+ customers we serve approximately 85% of the Fortune 500® and were proud to be one of FORTUNE 100 Best Companies to Work For® and Worlds Most Admired Companies™.Learn more on Life at Now blog and hear from our employees about their experiences working at ServiceNow.Unsure if you meet all the qualifications of a job description but are deeply excited about the role? We still encourage you to apply! At ServiceNow we are committed to creating an inclusive environment where all voices are heard valued and respected. We welcome all candidates including individuals from non-traditional varied backgrounds that might not come from a typical path connected to this role. We believe skills and experience are transferrable and the desire to dream big makes for great candidates.Job DescriptionJob DescriptionWe’re not yesterday’s IT department were Digital Technology. The world around us keeps changing and so do we. We’re redefining what it means to be IT with a mindset centered on transformation experience AI-driven automation innovation and growth. We’re all about delivering delightful secure customer and employee experiences that accelerate ServiceNow’s journey to become the defining enterprise software company of the 21st century. And we love co-creating using and highlighting our own products to do it. Ultimately we strive to make the world work better for our employees and customers—when you work in ServiceNow Digital Technology you work for them.We have a growing product engineering and design team and as the AI Platform Architect you will play a major part in enabling the next generation experiences powered by AI products on the Now platform. We need your help in building and making available an amazing range of solutions to our employees customers partners and more. If you are technical comfortable with ambiguity motivated by a fast-paced highly collaborative and entrepreneurial environment and have a knack for building alignment between multi-disciplinary yet integrated teams across various priorities then we are looking for you! What you get to do in this role:
Manage complex multi-disciplinary projects from start to finish and help the teams achieve the intended outcomes.  
Manage the process (and create one if it does not exist) to drive backlog grooming and prioritization identifying dependencies &amp; sequencing the deliverables and securing cross-functional teams’ commitment. 
Develop plans and help the teams stay on track by monitoring and providing on-going visibility to program status (progress against key milestones key decisions dependencies issues risks metrics etc.) to all stakeholders. 
Anticipate and aggressively remove obstacles that slow down or prevent program teams from delivering on program outcomes. 
Manage new and existing technologies integration 
Create a collaborative team environment that fosters creativity speed innovation and learning. 
Be a thought leader who can help accelerate the capabilities delivery and challenge others to change. 
QualificationsTo be successful in this role you must have:
Bachelor’s degree in computer science engineering or a related technical discipline. 
8+ Years of technical program management experience managing complex cloud-native products applications and platforms  
Deep understanding of Systems Engineering principles in product development 
Prior experience with developing and delivering technology projects or products
Experience managing projects across cross functional teams in multiple geo-locations building sustainable processes and coordinating release schedules 
Expertise in rapidly standing up processes and collaborative platforms like Share point and building reports and dashboards 
Ability to learn fast and master technical subjects and technologies relevant to the program. 
Strong planning scheduling and organization skills.  
Excellent verbal and written communication skills.  
Ability to work in a fast paced dynamic and fun team environment .
Team player attitude and willingness to work across the organization and company to continue improving the way we serve our customers.  
Preferred Qualifications/Skills: 
Master’s degree in computer science engineering or a related technical discipline. 
Experience working directly with machine learning technologies statistical systems or big data platforms 
Basic knowledge and some exposure to Generative AI landscape and Large Language models highly desirable
Prior experience with ServiceNow products and/or processes
Proven results from establishing and optimizing software engineering processes for different organizations/environments 
Experience in a start-up environment is beneficial. 
#DTjobsAdditional InformationServiceNow is an Equal Employment Opportunity Employer. All qualified applicants will receive consideration for employment without regard to race color creed religion sex sexual orientation national origin or nationality ancestry age disability gender identity or expression marital status veteran status or any other category protected by law.At ServiceNow we lead with flexibility and trust in our distributed world of work. Click here to learn about our work personas: flexible remote and required-in-office.If you require a reasonable accommodation to complete any part of the application process or are limited in the ability or unable to access or use this online application process and need an alternative method for applying you may contact us at talent.acquisition@servicenow.com for assistance.For positions requiring access to technical data subject to export control regulations including Export Administration Regulations (EAR) ServiceNow may have to obtain export licensing approval from the U.S. Government for certain individuals. All employment is contingent upon ServiceNow obtaining any export license or other approval that may be required by the U.S. Government.Please Note: Fraudulent job postings/job scams are increasingly common. Click here to learn what to watch out for and how to protect yourself. All genuine ServiceNow job postings can be found through the ServiceNow Careers site.From Fortune. © 2022 Fortune Media IP Limited All rights reserved. Used under license.Fortune and Fortune Media IP Limited are not affiliated with and do not endorse products or services of ServiceNow.Originally posted on Himalayas",2024-01-12,United States,2024-01-12 00:09:19.607792
Node Software Developer - Remote,https://himalayas.app/companies/anderson-optimization/jobs/node-software-developer-remote-7322681937,"Anderson Optimization (AO) is a leading software as a service (SaaS) provider in the renewable energy development industry. We work with top solar wind and battery developers across the US and abroad to efficiently bring more renewable energy onto the power grid. We are scaling rapidly and need the talent to support this growth. Our culture is autonomous with a heavy emphasis on work/life balance.What youll do...You will be embedded in a cross functional (frontend/backend) team and assist with the development of our node based backend. Your duties will include developing maintaining and performing an active contributor role over our software. You will be expected to take requirements and deliver production level code effectively and in a timely manner. In addition with your experience you will voice your opinions on software architecture and start to perform code reviews. Our team uses an agile kanban development approach and is a fully remote team.Responsibilities:
Develop high-quality software design and architecture
Taking ownership of new feature development and bug fixes
Develop tools and applications by producing clean efficient code
Automate tasks through appropriate tools and scripting
Review and debug code
Perform validation and verification testing
Collaborate with internal teams and vendors to fix and improve products
RequirementsRequired: 
Minimum 5 years professional software engineering experience or 3 years of professional software engineering experience and a degree in computer science
Minimum 3 years professional experience as a back-end node software developer
More than 1 year hands on SQL experience
Strong written and verbal communication skills and the ability to work asynchronously
Familiarity with agile kanban development process
Experience with common frameworks (express/fastify)
Analytical mind with problem-solving aptitude
Desired:
Experience with a remote development team
Experience developing APIs
Experience with backend gis frameworks desired (GDAL/OGR PostGIS Geoserver)
Strong understanding of unit testing
Experience with authentication protocols
Familiarity with Python
Ability to work independently
BenefitsWhat we offer:
$95K - $145K
Salary range is based on years of experience experience in industry and relevant skill set.
401(K) + 4% Match
Medical dental vision
No vacation limit minimum 3 weeks
Half day summer Fridays
Work from anywhere / 100% remote (office available in Boulder CO if you prefer working onsite)
Originally posted on Himalayas",2024-01-12,United States,2024-01-12 00:09:19.683787
"Lead Data Scientist, Business Analytics",https://himalayas.app/companies/thumbtack/jobs/lead-data-scientist-business-analytics,"
A home is the biggest investment most people make and yet it doesn’t come with a manual. Thats why we’re building the only app homeowners need to effortlessly manage their homes —  knowing what to do when to do it and who to hire. With Thumbtack millions of people care for what matters most and pros earn billions of dollars through our platform. And as one of the fastest-growing companies in a $600B+ industry — we must be doing something right. 
We are driven by a common goal and the deep satisfaction that comes from knowing our work supports local economies helps small businesses grow and brings homeowners peace of mind. We’re seeking people who continually put our purpose first: advocating for pros and customers embracing change and choosing teamwork every day.
At Thumbtack were creating a new era of home care. If making an impact and the chance to do good inspires you join us. Imagine what we’ll build together. 

Thumbtack by the Numbers

Available nationwide in all 3143 U.S. counties
75 million+ projects started on Thumbtack

About 4 million customers in the last 12 months
Pros earn billions on our platform
About 10 million 5-star reviews for our stellar pros 
1000+ employees and $3.2 billion valuation (June 2021) 

About the Business Analytics TeamThe Business Analytics team’s mission is to unlock strategic opportunities and enable Thumbtack to achieve its full business potential. To accomplish this mission we focus on:

Business performance: Metrics dashboards and forums that help us measure progress towards our goals and foster deep understanding of our business.

Strategic insights: Analytics to uncover insights that will be game-changers for our business and that inform company strategy and team execution.

Telling Thumbtack’s story: Using metrics and data visualization to tell Thumbtack’s story to investors board members our team and the world.

Building a world-class team: hiring the best and investing in coaching learning and team building.
We are a tight-knit group that is passionate about driving business impact through data science and analytics.About the RoleAs a Business Analytics team member you’ll drive insights and action across the breadth of the marketplace. You’ll be a steward of key company metrics and dashboards and dive deep on analytical questions that are critical to Thumbtack’s success. You’ll partner with our leadership team to develop company strategy and goals share performance updates with the Board and work with teams across the business to drive actionable insights and business impact. This particular role will focus on business intelligence and business performance reporting.Responsibilities
Define monitor and report on the key metrics that measure Thumbtack’s success
Lead business performance analysis and reporting to inform leadership of emerging risks and opportunities
Conduct deep dive analysis to answer key questions that are critical to Thumbtack’s future strategy
Support and improve company revenue forecasting model and forecasting/planning process
Partner effectively with teams across the company including Product Engineering Marketing Operations Finance as well as Thumbtack’s leadership team
Contribute to our team and company data culture through peer collaboration training coaching and more
What youll needIf you dont think you meet all of the criteria below but still are interested in the job please apply. Nobody checks every box and were looking for someone excited to join the team.
BA/BS degree preferably in Economics Business Math Statistics or Computer Science
6+ years of experience in a highly analytical role preferably with experience in tech analytics
Proficiency using SQL  Python/R to analyze large data sets
Exemplary analytical problem solving skills including solid statistics foundation strong business judgment and the ability to identify and synthesize insights from analysis
Ability to work with company executives to understand the company’s business needs and drive decisions
Strong communicator attentive listener and compelling explainer
Bonus points if you have
Experience working in a marketplace business
Experience with revenue modeling  forecasting in a public company
Thumbtack is a virtual-first company meaning you can live and work from any one of our approved locations across the United States Canada or the Philippines.* Learn more about our virtual-first working model here. 
Benefits  Perks

Virtual-first working model coupled with in-person events
20 company-wide holidays including a week-long end-of-year company shutdown
Libraries (collaborative workspaces) in San Francisco Salt Lake City Toronto and Manila 
Stipends for remote work support home office set-up and Thumbtack services (North America) 
WiFi reimbursements 
Cell phone reimbursements (North America) 
Employee Assistance Program for mental health and well-being 

Learn More About Us 


Life @ Thumbtack Blog 

How Thumbtack is embracing virtual work
Follow us on LinkedIn 
Meet the pros who inspire us

Thumbtack embraces diversity. We are proud to be an equal opportunity workplace and do not discriminate on the basis of sex race color age pregnancy sexual orientation gender identity or expression religion national origin ancestry citizenship marital status military or veteran status genetic information disability status or any other characteristic protected by federal provincial state or local law. We also will consider for employment qualified applicants with arrest and conviction records consistent with applicable law. 
Thumbtack is committed to working with and providing reasonable accommodation to individuals with disabilities. If you would like to request a reasonable accommodation for a medical condition or disability during any part of the application process please contact: recruitingops@thumbtack.com. 
If you are a California resident please review information regarding your rights under California privacy laws contained in Thumbtack’s Privacy policy available at https://www.thumbtack.com/privacy/ .
Originally posted on Himalayas",2024-01-12,Canada,2024-01-12 00:09:19.748838
Mid/Senior 3D Artist(s),https://himalayas.app/companies/city-state-entertainment/jobs/mid-senior-3d-artist-s,"Company DescriptionCity State Entertainment is an independent video game development studio founded in March 2011 in Fairfax Virginia. The studio embodies an “open office” collaborative process where all team members are expected to contribute to the design and the development process. The team has built a next-generation engine tentatively titled the Unchained Engine which is powering their two games in development - Camelot Unchained a niche RvR old-school MMORPG (currently in Beta) and Final Stand: Ragnarok a PvE looter-slasher in which teams of any size fight against hordes of NPCs (currently in very Early Access on Steam).Job DescriptionCity State Entertainment is looking for an experienced 3D Artist (generalist) who has passion for creating 3D Art. Experience working across a variety of styles/purposes (such as Characters Props Hard Surface Soft Cloth or Environments) and some in-engine and Z-Brush (Hard surfacing) experience would be an advantage for this role.Responsibilities:
Model and texture a variety of high quality 3D assets ranging from characters to props. This includes sculpt as well as material work.• Collaborate with members of the art team. Join in reviews taking feedback and making adjustments or iterations asset requires.
QualificationsWhat we are looking for:
2+ years experience as a 3D modeler or similar role• Understanding of artistic principles including: form proportions volume silhouette color ect...• Strong Maya/Max Photoshop Zbrush Substance Painter skills.• Portfolio showcasing capable artistic skill modeling characters and/or props• Knowledge creating and optimizing assets for games• A strong communicator that is willing to seek out others when in need of and give as well in return
• Passion for games specifically MMOs
Able to work online in our Fairfax Virginia or our Seattle Washington office. Remote work from any location also an option
Additional InformationBonus:
Has experience creating structures/buildings for game environments• Embraces always learning and refining one’s craft
Note: City State Entertainment is hiring for a broad range of positions on a growing team. We have definite skill and task needs but the eventual division of tasks within the team will depend on the eventual team members. If you’re an outstanding and talented individual whose qualifications fall halfway between two of our listings we’d still like to hear from you. All candidates must have excellent written and verbal communication skills. We are an emphatically equal-opportunity employer. Originally posted on Himalayas",2024-01-12,United States,2024-01-12 00:09:19.827551
Internal Audit Senior Manager - Single Family (Open to Remote),https://himalayas.app/companies/fannie-mae/jobs/internal-audit-senior-manager-single-family-open-to-remote-7156827300,"Company DescriptionAt Fannie Mae futures are made. The inspiring work we do helps make a home a possibility for millions of homeowners and renters. Every day offers compelling opportunities to impact the future of the housing industry while being part of an inclusive team thriving in an energizing flexible environment. Here you will grow your career and help create access to fair affordable housing finance.Job DescriptionFannie Mae’s Audit function’s vision is to be a trusted and forward-thinking internal audit function that develops thought leaders recognized for enhancing organizational success through delivery of risk-based internal audit services. Our team provides independent objective assurance and other advisory services that contribute to the effectiveness of risk management compliance and controls employed by management. We attract retain and develop a diverse team focused on driving thought leadership and on delivering value-added insights. Our agility enables us to evolve into a dynamic risk-driven audit practice that is responsive to emerging risks and we leverage data analytics and other technologies to increase efficiency and effectiveness.As a valued leader on our team you will play a role in developing a strategic plan for examining and analyzing records to determine effectiveness of operating and reporting procedures.THE IMPACT YOU WILL MAKEThe Internal Audit Senior Manager - Single Family role will offer you the flexibility to make each day your own while working alongside people who care so that you can deliver on the following responsibilities:
Leadership and execution of a portfolio of Single-Family Enterprise Operations and Capital Markets integrated audits as well as the development of an analytics-based continuous risk monitoring strategy for emerging risk themes (Credit Operational Market).
Define audit objective and audit scope appropriate for assessing internal controls and risk management practices oversee audit fieldwork execution communicate audit findings verbally and in writing assess management’s remediation plans and review audit work papers in line with audit methodologies.
Motivate influence and develop audit staff and work with members of integrated audit teams to execute the audit plan.  
Establish high impact relationships with key members of Audit and business management.
Identify and share best practices and efficiency opportunities with business and functional units based on audits and continuous risk monitoring results.
Contribute to the continuous improvement of our risk assessment monitoring and reporting methodology.
QualificationsTHE EXPERIENCE YOU BRING TO THE TEAMMinimum Required Experience
6 years of relevant experience 8 years preferred
CPA CISA or CIA certification
Desired Experience
Bachelors degree or equivalent
Extensive technical acumen across internal audit and strong knowledge in risk management and control domains including but not limited to credit market compliance and operational risks (inclusive of technology general controls)
Adept at managing project plans and resources to ensure successful project completion.
Experienced in Risk Assessment and Management including evaluating the design of controls conducting impact assessments identifying control gaps and remediating risk.
Proficient in communicating in writing or verbally facilitating meetings inclusive of developing and distributing agendas reports and presentations.
Skilled in documentation and database reporting for the purposes of analysis data discovery and decision-making with the use of relevant software.
Relationship Management skills including engaging stakeholders and audit customers and building relationship networks.
Information Retrieval skills including fact gathering conducting interviews and designing surveys.
Experienced in governance and compliance including assessing policies evaluating compliance conducting internal investigations and developing data governance.
Experience working with individuals having a different functional expertise respectfully and cooperatively while working toward a common goal.
Skilled in data analysis and the graphical representation of information in the form of a charts diagrams pictures and dashboards with programs and tools such as Excel Tableau or Power BI.
Ability to frame ideas as systems and analyzing the inputs outputs and process.
Experience analyzing data to identify trends or relationships to inform conclusions about the data.
Influencing skills including negotiating persuading others facilitating meetings and resolving conflict.
Skilled in presenting information and/or ideas to an audience in a way that is engaging and easy to understand.
Experience with credit operational (inclusive of technology general controls) or market risks and associated mitigants.
Experience in large multi-national financial institutions (e.g. SIFI) with detailed understanding of the policies processes and risks within a wide variety of functional areas and their impact on the business control environment
Additional InformationThe future is what you make it to be. Discover compelling opportunities at Fanniemae.com/careersFannie Mae is primarily a hybrid company.  We embrace flexibility for our employees while providing office space for in-person work and collaboration.  This role is classified as open to remote.  If you speak with a Recruiter they will provide you with more information about the definition of this classification.Fannie Mae is an Equal Opportunity Employer which means we are committed to fostering a diverse and inclusive workplace. All qualified applicants will receive consideration for employment without regard to race religion national origin gender gender identity sexual orientation personal appearance protected veteran status disability age or other legally protected status. For individuals with disabilities who would like to request an accommodation in the application process email us at careers_mailbox@fanniemae.comThe hiring range for this role is set forth on each of our job postings located on Fannie Maes Career Site. Final salaries will generally vary within that range based on factors that include but are not limited to skill set depth of experience certifications and other relevant qualifications. This position is eligible to participate in a Fannie Mae incentive program (subject to the terms of the program). As part of our comprehensive benefits package Fannie Mae offers a broad range of Health Life Voluntary Lifestyle and other benefits and perks that enhance an employee’s physical mental emotional and financial well-being. See more here.Originally posted on Himalayas",2024-01-12,United States,2024-01-12 00:09:19.906971
