title,link,description,pubdate,location,timestamp
"Senior Customer Success Manager, Government",https://himalayas.app/companies/betterup/jobs/senior-customer-success-manager-government,"Let’s face it a company whose mission is human transformation better have some fresh thinking about the employer/employee relationship. We do. We can’t cram it all in here but you’ll start noticing it from the first interview. Even our candidate experience is different. And when you get an offer from us (and accept it) you get way more than a paycheck. You get a personal BetterUp Coach a development plan a trained and coached manager the most amazing team you’ve ever met (yes each with their own personal BetterUp Coach) and most importantly work that matters. This makes for a remarkably focused and fulfilling work experience. Frankly it’s not for everyone. But for people with fire in their belly it’s a game-changing career-defining soul-lifting move.Join us and we promise you the most intense and fulfilling years of your career doing life-changing work in a fun inventive soulful culture. If that sounds exciting—and the job description below feels like a fit—we really should start talking. The Government Customer Success Manager (CSM) role contributes to the mission of BetterUp by ensuring that our customers and members receive the full value of the BetterUp platform. You’ll work with partners across the Department of Defense Federal Civilian Agencies and state and local governments to help accomplish their missions. The Government CSM leads the end-to-end partner lifecycle journey from design to value and outcome delivery. Our Customer Success Managers are our clients’ key strategists consultants and growth planners. CSMs partner with the Account Management and Implementation teams to drive adoption renewals and expansions. Leadership skills client service orientation strategic consulting project management relationship mastery problem-solving and storytelling are the core skills exercised in this role.What you’ll do:
Build rapport with and expand customer/executive sponsorship and champions aligning internal BetterUp resources to further relationships and account health. 
Be a true champion of account health taking action on early warning signals; escalating to leadership appropriately. Ensures best-in-class program engagement across all programs regardless of size teeing Government partners up for expansions well ahead of the renewal period. 
Create thoughtful value-based recommendations that help customers maximize value; make internal recommendations on customizations or ways to serve globally while balancing ROI scale and time to market. 
Drive problem-solving and risk mitigation strategies engaging cross-functional partners to get results. Oversee customer-centric projects or customizations as required.
Manage relationships with program sponsors and day-to-day partners while teaming with your account team to increase the breadth and depth of relationships. Become a true advocate of your customer’s best interest internally at BetterUp as well as with the customer’s of BetterUp.
Understand customer strategy and challenges; align BetterUp’s Human Transformation Platform with their internal narrative and desired outcomes to maximize insights and value.
Contribute to the evolution of our product  product functionality product marketing and internal and customer best practices 
Ability to travel for up to 10% of the time.
Preference for candidate to be located in the Washington D.C. metropolitan area.
If you have some or all of the following please apply:
Previous experience building deep relationships with customers stakeholders and client teams. Must have previously served as the main point of contact for customers. 
Strong experience keeping customers’ expectations grounded in reality and pushing back while maintaining a positive relationship. Must be able to be prescriptive consultative and credible. 
Project management experience and/or experience managing multiple projects with separate stakeholders at once.
Must have demonstrated ability to build industry or company-specific knowledge and business acumen and engage with senior leadership of large organizations.
Strong experience inspiring customers to do something different. Should have experience consulting or managing customers in a solution that required behavior change of end-users. 
Experience in the HCM SaaS space or Talent disciplines is highly valued though not required.
Experience in the Public Sector space especially with Department of Defense and cabinet-level Federal agencies is highly valued though not required.
Benefits:At BetterUp we are committed to living out our mission every day and that starts with providing benefits that allow our employees to care for themselves support their families and give back to their community. 
Access to BetterUp coaching; one for you and one for a friend or family member 
A competitive compensation plan with opportunity for advancement
Medical dental and vision insurance
Flexible paid time off
Per year: 

All federal/statutory holidays observed
4 BetterUp Inner Work days (https://www.betterup.co/inner-work)
5 Volunteer Days to give back
Learning and Development stipend
Company wide Summer  Winter breaks 

Year-round charitable contribution of your choice on behalf of BetterUp

401(k) self contribution
We are dedicated to building diverse teams that fuel an authentic workplace and sense of belonging for each and every employee. We know applying for a job can be intimidating please don’t hesitate to reach out — we encourage everyone interested in joining us to apply.BetterUp Inc. provides equal employment opportunities (EEO) to all employees and applicants for employment without regard to race color religion sex national origin disability genetics gender sexual orientation age marital status veteran status. In addition to federal law requirements BetterUp Inc. complies with applicable state and local laws governing nondiscrimination in employment in every location in which the company has facilities. This policy applies to all terms and conditions of employment including recruiting hiring placement promotion termination layoff recall transfer leaves of absence compensation and training.At BetterUp we compensate our employees fairly for their work. Base salary is determined by job-related experience education/training residence location as well as market indicators. The range below is representative of base salary only and does not include equity sales bonus plans (when applicable) and benefits. This range may be modified in the future.The base salary range for this role is $107000 – $179000.If you live in New York the base salary range for this role is: $119000 – $179000: New York City$113000 – $169000: Nassau Newburgh$107000 – $161000: Albany Buffalo Rochester SyracuseWe value your privacy. Your personal data will be processed in accordance with our Privacy Policy. If you have any questions about the privacy of your personal data or your rights with regards to your personal data please reach out to support@betterup.coOriginally posted on Himalayas",2024-01-12,United States,2024-01-12 00:09:21.867176
Freelance Text-Based Tutor (Non-Voice),https://himalayas.app/companies/course-hero/jobs/freelance-text-based-tutor-non-voice-384288100,"Company DescriptionCourse Hero is on a mission to help students graduate confident and prepared. The online learning platform offers over 60 million course-specific study resources created by and for students and educators as well as 24/7 tutor help. More than 65000 verified college educators use Course Hero to collaborate with other faculty and share resources to hone new strategies for instruction. Everyday students educators and tutors help more than 20 million students make every study hour count.We have an awesome team and a truly engaging culture. We are customer-focused collaborative responsible gritty and we love to learn. Our bold mission is to help students graduate confident and prepared!We are not the only ones that think we’re onto something big. Course Hero has been recognized as one of the 2021 Top 100 Best Places to Work in the Bay Area Top 50 Best Paying Companies in the Bay Area Top 100 Most Transparent Companies and in the Top 50 Most Transformational Companies in Education Technology. Read up on some of our recent news coverage blog and learn more about us to see what it is like to work with our team.Job DescriptionCourse Hero is growing our global team of tutors! Course Hero is hiring experts in a wide variety of subjects who want to leverage their knowledge to answer text based questions and support our community of 20+ million students.As a tutor on Course Hero you will choose the subjects in which you want to answer questions. You will then select questions and provide text based answers and explanations to students who need help better understanding the questions topics and subjects they are studying.The benefits of being a tutor on Course Hero include:

Earn $$$: Tutors earn $2-$15 per question and top tutors can earn $1500+ per month (earnings vary depending on the number of questions answered subject category question difficulty answer quality and other factors).

Work when you want: All questions and answers are text based so no audio or video is required. This means tutors can answer questions anytime and from anywhere. Tutors can also choose how many questions they want to answer.

Help students learn: By sharing guidance and expertise tutors empower students to learn more effectively and by doing so feel more confident and prepared both in school and after graduation.

Build your resume: Tutors can feature their tutoring experience on their resume. Whether you’re looking for your first job or your next job tutoring is a great way to show that you’re growing and developing your knowledge.

Sharpen your expertise: Whether you’re a professional recent graduate or current student being a tutor and answering questions will sharpen your expertise and strengthen your skill set.

QualificationsRequirements to apply include:
Ability to read and write fluently in English
A second year college student or above
Proof of education:
Official Transcript of Grades showing individual grades for each course 
Alternative: Online Copy of Grades (must show full web address full subject/course names and full name) 
*For multi-page document compile to PDF file 
*If the last name on your Proof of Education and the last name on your valid ID dont match please upload a merged PDF that contains both your Proof of Education and your marriage certificate.




Additional InformationTo apply please use the following resources:
Application link: https://chtutor.com/SmartApply
Referral code: MJSP24Q1

Step-by-step application guide: https://bit.ly/CHapplicationprocess
Share this opportunity with your friends and colleagues: https://bit.ly/AspiringHero
We are currently looking for experts from these Subjects:

Science Biology Chemistry Health Science Nursing Physics

Math Algebra Calculus Math - Other Statistics and Probability

Engineering Computer Science

Accounting Business etc. Financial Accounting General Accounting General Business General Finance General Economics General Management Human Resource Management Marketing Communications Business Law
Originally posted on Himalayas",2024-01-12,Philippines,2024-01-12 00:09:21.931241
"Principal Product Manager, Home Guidance",https://himalayas.app/companies/thumbtack/jobs/principal-product-manager-home-guidance,"
A home is the biggest investment most people make and yet it doesn’t come with a manual. Thats why we’re building the only app homeowners need to effortlessly manage their homes —  knowing what to do when to do it and who to hire. With Thumbtack millions of people care for what matters most and pros earn billions of dollars through our platform. And as one of the fastest-growing companies in a $600B+ industry — we must be doing something right. 
We are driven by a common goal and the deep satisfaction that comes from knowing our work supports local economies helps small businesses grow and brings homeowners peace of mind. We’re seeking people who continually put our purpose first: advocating for pros and customers embracing change and choosing teamwork every day.
At Thumbtack were creating a new era of home care. If making an impact and the chance to do good inspires you join us. Imagine what we’ll build together. 

Thumbtack by the Numbers

Available nationwide in all 3143 U.S. counties
75 million+ projects started on Thumbtack

About 4 million customers in the last 12 months
Pros earn billions on our platform
About 10 million 5-star reviews for our stellar pros 
1000+ employees and $3.2 billion valuation (June 2021) 

About the Guide Team The Guide team has one of the most exciting charters within Thumbtack’s product portfolio focusing on realizing our vision of being a trusted unbiased advisor to customer. The scope is broad as we envision helping customers understand what to do when across use cases including seasonal maintenance moving/home purchase energy savings and renovations/remodels.About the RoleAs the Product Manager you will lead an exceptional cross functional team in defining and executing our Guide strategy. You’ll have tremendous customer impact by setting them up to proactively care for their homes. You’ll play a key role in growing our customer lifetime value and delivering more jobs to pros.Responsibilities
Develop and communicate our Guide strategy in partnership with a fantastic team xfunctional partners
Evangelize that strategy across Thumbtack to ensure customers always have access to the right guidance at the right time
Partner with product and content designers engineers user research and marketers to ideate prioritize and deliver our guide experience
Define and analyze key metrics to inform decision-making and measure success
Coordinate within your team and among teams at Thumbtack to ensure understanding of and alignment around projects
What you’ll need If you dont think you meet all of the criteria below but still are interested in the job please apply. Nobody checks every box and were looking for someone excited to join the team.
5+ years of product management experience building consumer web/mobile products
Experience with building a 0-1 product
Experience with setting product strategy at a highly rigorous level
Exceptional cross functional leadership abilities
Excellent analytical skills to break down and solve complex problems
Bonus points if you have 
Experience working in a marketplace business
Experience working in a content-rich product area
Thumbtack is a virtual-first company meaning you can live and work from any one of our approved locations across the United States Canada or the Philippines.* Learn more about our virtual-first working model here.
Benefits  Perks

Virtual-first working model coupled with in-person events
20 company-wide holidays including a week-long end-of-year company shutdown
Libraries (collaborative workspaces) in San Francisco Salt Lake City Toronto and Manila 
Stipends for remote work support home office set-up and Thumbtack services (North America) 
WiFi reimbursements 
Cell phone reimbursements (North America) 
Employee Assistance Program for mental health and well-being 

Learn More About Us 


Life @ Thumbtack Blog 

How Thumbtack is embracing virtual work
Follow us on LinkedIn 
Meet the pros who inspire us

Thumbtack embraces diversity. We are proud to be an equal opportunity workplace and do not discriminate on the basis of sex race color age pregnancy sexual orientation gender identity or expression religion national origin ancestry citizenship marital status military or veteran status genetic information disability status or any other characteristic protected by federal provincial state or local law. We also will consider for employment qualified applicants with arrest and conviction records consistent with applicable law. 
Thumbtack is committed to working with and providing reasonable accommodation to individuals with disabilities. If you would like to request a reasonable accommodation for a medical condition or disability during any part of the application process please contact: recruitingops@thumbtack.com. 
If you are a California resident please review information regarding your rights under California privacy laws contained in Thumbtack’s Privacy policy available at https://www.thumbtack.com/privacy/ .
Originally posted on Himalayas",2024-01-12,Canada,2024-01-12 00:09:22.010542
Strategic Account Executive,https://himalayas.app/companies/netlify/jobs/strategic-account-executive-9609866401,"About The Team:Netlify’s vision is to build a better web. To get there we aim to unite the Jamstack ecosystem to create the best developer experience for that web. More than 4M businesses  developers worldwide use Netlify to build run and scale modern web experiences ranging from major ecommerce sites to SaaS applications marketing sites and everything in between. As that number grows were excited to bring onboard a Strategic Account Executive to help prospective customers navigate and evaluate our solutions to ensure they are set up for long-term success.What You’ll Do: 
Consistently deliver against revenue and pipeline targets
Use your expertise and prior experience to sell complex technical products
Own and run a sophisticated pipeline generation  process to break into target accounts with the support of the wider Go-To-Market team (BDRs Marketing Partner Managers Execs etc)
Project manage a technical sales process engaging with technical and business stakeholders in Engineering Marketing Product and C-Level
Collaborate with internal stakeholders to achieve desired customer outcomes
Partner with prospects to understand business challenges requirements and desired business outcomes in order to build a thorough business case 
Drive team projects that further develop Netlify’s sales process and go-to-market strategy
Advocate internally on behalf of customers including with our product and engineering teams who craft their road maps directly from customer feedback
What Youll Bring: 
At least several years of quota-carrying sales experience closing strategic clients with a focus on selling technical products
An extensive history of successfully closing enterprise-level deals for complex technical products with an ASP  $100K+ while regularly exceeding sales goals of 1M+
Well-versed in selling to technical audiences translating technical requirements and outcomes into business requirements and outcomes and understanding the nuances of our industry
Consultative sales approach with a product-centric mindset with a passion for leading strategic outbound efforts and breaking into large logos
Strong prospecting qualifying and negotiating skills
A good sense of strategic thinking with the aptitude to identify and seize opportunities.
Embody a growth mindset that seeks to constantly learn and develop
A collaborative mindset and demonstrated ability to work across multiple internal and external stakeholders with different priorities
Excitement to work in a high-growth environment and to help build processes and tools as needed
We welcome candidates based in the United States or Canada for this position. 
ApplyingNot sure you meet 100% of our qualifications? Please apply anyway!When applying please include: A resume or short listing of your job history  skills (link to a LinkedIn profile would be fine). We appreciate a cover letter explaining why you would enjoy working in this role at Netlify to get to know you a bit better though this is not required and will not impact your application. Our mission is to “build a better web” and that cannot be done without a diversity of skill sets backgrounds and thoughts. Of everything weve ever built at Netlify we are most proud of our team. Netlify is an Equal Opportunity Employer. We are devoted to building a team of people with diverse backgrounds and lifestyles. Driving equality empowers our team enables us to innovate and helps us maintain a more inclusive environment. We don’t discriminate against employees or applicants based on gender identity or expression sexual orientation religion age race military/veteran status citizenship pregnancy status or any other differences. If we can do anything to provide a better interview i.e. accommodate a disability then please let us know by emailing accommodations@netlify.com. About NetlifyAt Netlify we’re on a mission to build a better web by making it easier than ever to build deploy and scale web applications. We are a Series D company with a $2B valuation and have raised over $200M from investors such as Andreessen Horowitz Kleiner Perkins EQT Bessemer BOND and Menlo Ventures. As a globally distributed organization we aim to create a company culture where the best idea can come from anywhere and strive to be thoughtful caring and collaborative in our work within and across teams.  To learn a bit more about our team and who we are make sure to visit our About page. At Netlify we are committed to equal pay for equal work. Netlify anchors our compensation philosophy on a market-based approach therefore salary ranges may differ depending on the cost of labor in a particular location. Our base compensation for this role is targeted at $134500 - $181500 for most US-based locations. Because this role is eligible to participate in Netlifys commission plan it is common for employees in this role to receive total on-target earnings of $268500 to $363500. Candidates based outside of the US or in premium markets such as New York City San Francisco Los Angeles Boston Seattle and Austin should consult with their Talent Acquisition partner regarding location-based ranges as it may be higher or lower than the average US range listed. The starting pay will be determined based on multiple factors including expertise and skills market demands experience internal equity and applicable geographic location. The salary provided is in addition to robust benefits and participation in Netlify’s equity plan. These compensation packages and ranges are subject to change and may be modified in the future. Your Talent Acquisition partner will be available to answer any questions during the hiring process.Originally posted on Himalayas",2024-01-12,Canada United States,2024-01-12 00:09:22.089493
