title,link,description,pubdate,location,timestamp
Solutions Architect,https://himalayas.app/companies/synack/jobs/solutions-architect-7702269618,"At Synack we create technology that unleashes the best cybersecurity talent to secure our digital world.We protect leading global organizations by reducing companies’ security risk and increasing their resistance to cyber attack. How do we do this? By utilizing the world’s best and most trusted team of ethical hackers who test through our powerful and controlled platform to deliver real security without compromise.Backed by top-tier venture capital firms including Kleiner Perkins Caufield  Byers Microsoft and Google Ventures Synacks mission is to leverage global security talent coupled with advanced technology to help enterprises discover security vulnerabilities before they become business problems. Discover the possibilities at Synack!As the Solutions Architect responsible for Enterprise clients you will partner with Synack Account Executives and Customer Success Leaders to drive acquisition of new logos and growth in existing accounts as part of the commercial team. You will navigate complex accounts generate and deliver winning proposals contract bids statements of work and RFI/RFP responses. Reporting to the NA Director of Solutions Architects this is an individual contributor role requiring a highly motivated self-starter responsible for achieving sales quotas and goals in line with the overall sales strategies for the regional territory. This is a remote position and qualified candidates must be located in the North Central region of the US.You apply your technical knowledge of the security testing field and your product expertise to build appropriate solutions for prospects and expansion plans for existing clients. You have experience navigating complex accounts to understand explicit needs and align solutions that meet customer objectives. You enable winning proposals contract bids statements of work and RFI/RFP responses.Sounds interesting? Keep reading...Here’s what youll do
Deliver comprehensive technical validation and planning including:
Understanding the digital attack surface and value at risk
Performing hands on black and gray box surveys of applications and networks
Documenting and reporting survey findings with customers and internal stakeholders
Understanding the customers existing vulnerability and security testing programs tools and methods including Enterprise Risk Management (ERM) requirements and goals
Leverage your findings to create technical proposals and position successful account strategies that align with customer goals


Support the Synack Commercial business through executive level planning and execution of key account development and clear understanding of the customer needs directives and challenges
Build  develop consultative  relationships and support the  alignment of the Synack field team to prospective and existing customer needs and objectives
Craft and solution offerings to meet near and long term testing objectives with strong business acumen
Partner with internal stakeholders to develop and execute key account development plans
Educate and enable customers through an understanding of their testing options outside of traditional support models 
Support Executive Business Reviews with customers to provide technical validation for recurring revenue and drive new business
Support account strategy development  and contribute to and leverage a team  in execution 
Contribute to and tailor marketing materials pricing strategies feature needs license models 
Consistently demonstrate strong product knowledge and deliver the Synack value proposition through customer conversations
Here’s what you’ll need
4+ years of proven experience with technical sales Commercial
Strong hands-on technical background with a consultative approach
Excellent business writing and presentation skills
Ability to articulate issues and concerns to executives and product teams
Knowledge of penetration testing methodologies tools and common requirements
Experience with vulnerability management risk management frameworks and associated business workflows
Knowledge of cyber security requirements for large enterprise environments and how to leverage partners to amplify a value proposition
Understanding of a SaaS business model with demonstrated experience driving deals from top of funnel through deal execution
Relevant industry certifications a plus (e.g. Network+ Security+ CISA CEH CISSP)
Compliance and audit familiarity a plus (SRG STIG NIST PCI)
Ready to join us?Synack is committed to embracing diversity. Our people are our strength.  Each addition to our team is an opportunity to grow and diversify our ideas experiences and viewpoints. We strive to be inclusive of Race Ethnicity Religion Sex LGBTQ+ Veterans Disabilities and Age.  Synack welcomes you!As a candidate Synack cares about your privacy. Please view our candidate privacy policy here.$200000 - $240000 Salary is determined by a combination of factors including location level relevant experience and skills. The range displayed on each job posting reflects the minimum and maximum target for new hire salaries for the position across all US locations. The compensation package for this position may also include equity and benefits. For more details about our benefits please see here. Then for the Employer code enter: synackOriginally posted on Himalayas",2024-01-12,United States,2024-01-12 00:09:24.183606
Remote Licensed Mental Health Therapist LMFT LCSW LMHC LCSW-R,https://himalayas.app/companies/gotham-enterprises-ltd/jobs/remote-licensed-mental-health-therapist-lmft-lcsw-lmhc-lcsw-r-8560948478,"The Clinical Mental Health Professional utilizes clinical expertise to perform psychosocial assessments develop and implement plans of care appropriate care team assess crisis situations to appropriately provide needed resources and or referrals for the patient and provide family and individual treatment as indicated. This position works collaboratively with patients significant other families healthcare providers insurers community resources and all other involved parties. This position provides care appropriate to the established plan of care in the assigned patient population.Related responsibilities of this role include but are not limited to:
Diagnoses and treats various mental emotional and behavioral disorders modifying care plan(s) to reflect changes in patient status
Refers patients to other services to improve their well-being. These referrals may include community services treatment programs support groups psychiatrists or other mental health providers.
Works with the multi-disciplinary team to develop a discharge plan in order to provide further care services and referrals in order to ensure continuity of care. • Complies with federal state local and clinical program/facility standards.
Acts within the scope of the Mental Health Practice Act. • Organizes and prioritizes daily work by assessing new current and discharging patient needs in area(s) of responsibility.
Performs social work consultation for patients and caregivers. Conducts psychosocial assessments. Provides supportive crisis bereavement and other social work interventions as necessary.
Educates communicates and coordinates with multiple patient care teams and outside agencies as necessary to ensure the patient receives quality care and a timely discharge and to identify and resolve delays and issues. Credentialing through medical staff office and peer review requirements may apply if working in the behavioral health setting.
May provide support and debriefing in conjunction with the Employee Assistance Program for staff members following adverse events.
Acts as an advocate on behalf of patients and families where appropriate to ensure effective communication with multidisciplinary care teams outside agencies and other resources as necessary.
May identify patients at risk for potentially avoidable delays extended stay readmission financial or complex discharge needs. Coordinate with care providers and leaders to reach optimal solutions.
RequirementsHow to Qualify:
To be eligible for the role therapists and counselors need to have a Masters degree in Social Work Psychology Marriage and Family Therapy or Mental Health Counseling.
One of the following independent licenses is required: LMFT LMHC LCSW LCSW-R.
Strong computer literacy skills are necessary for the role.
A successful counselor should possess professional evaluation skills decision-making skills and recommendation skills for treatment planning and implementation.
Excellent interpersonal skills and a sympathetic nature are important qualities for a counselor.
BenefitsBenefits
Fully Remote - You Set Your Own Schedule
• Sign on Bonus!!!
Flexible schedule PT/FT Independent Contract
• Bonus with the first client!
Health Insurance Stipend Eligibility for Health Insurance Stipend requires a min
• Work Location: Remote• Pay: $70000.00 - $100000.00 per year• Professional development assistance• Referral program• Choose your own hoursOriginally posted on Himalayas",2024-01-12,United States,2024-01-12 00:09:24.262269
Remote Licensed Mental Health Therapist LMFT LCSW LCMHC,https://himalayas.app/companies/gotham-enterprises-ltd/jobs/remote-licensed-mental-health-therapist-lmft-lcsw-lcmhc,"The Clinical Mental Health Professional utilizes clinical expertise to perform psychosocial assessments develop and implement plans of care appropriate care team assess crisis situations to appropriately provide needed resources and or referrals for the patient and provide family and individual treatment as indicated. This position works collaboratively with patients significant other families healthcare providers insurers community resources and all other involved parties. This position provides care appropriate to the established plan of care in the assigned patient population.Related responsibilities of this role include but are not limited to:
Diagnoses and treats various mental emotional and behavioral disorders modifying care plan(s) to reflect changes in patient status
Refers patients to other services to improve their well-being. These referrals may include community services treatment programs support groups psychiatrists or other mental health providers.
Works with the multi-disciplinary team to develop a discharge plan in order to provide further care services and referrals in order to ensure continuity of care. • Complies with federal state local and clinical program/facility standards.
Acts within the scope of the Mental Health Practice Act. • Organizes and prioritizes daily work by assessing new current and discharging patient needs in area(s) of responsibility.
Performs social work consultation for patients and caregivers. Conducts psychosocial assessments. Provides supportive crisis bereavement and other social work interventions as necessary.
Educates communicates and coordinates with multiple patient care teams and outside agencies as necessary to ensure the patient receives quality care and a timely discharge and to identify and resolve delays and issues. Credentialing through medical staff office and peer review requirements may apply if working in the behavioral health setting.
May provide support and debriefing in conjunction with the Employee Assistance Program for staff members following adverse events.
Acts as an advocate on behalf of patients and families where appropriate to ensure effective communication with multidisciplinary care teams outside agencies and other resources as necessary.
May identify patients at risk for potentially avoidable delays extended stay readmission financial or complex discharge needs. Coordinate with care providers and leaders to reach optimal solutions.
RequirementsHow to Qualify:
To be eligible for the role therapists and counselors need to have a Masters degree in Social Work Psychology Marriage and Family Therapy or Mental Health Counseling.
One of the following independent licenses is required: LMFT LCMHC LCSW

Strong computer literacy skills are necessary for the role.
A successful counselor should possess professional evaluation skills decision-making skills and recommendation skills for treatment planning and implementation.
Excellent interpersonal skills and a sympathetic nature are important qualities for a counselor.
BenefitsBenefits
Fully Remote - You Set Your Own Schedule
• Sign on Bonus!!!
Flexible schedule PT/FT Independent Contract
• Bonus with the first client!
Health Insurance Stipend Eligibility for Health Insurance Stipend requires a min
• Work Location: Remote• Pay: $70000.00 - $100000.00 per year• Professional development assistance• Referral program• Choose your own hoursOriginally posted on Himalayas",2024-01-12,United States,2024-01-12 00:09:24.340781
Front End Software Developer - Remote,https://himalayas.app/companies/anderson-optimization/jobs/front-end-software-developer-remote,"Anderson Optimization (AO) is a leading software as a service (SaaS) provider in the renewable energy development industry. We work with top solar wind and battery developers across the US and abroad to efficiently bring more renewable energy onto the power grid. We are scaling rapidly and need the talent to support this growth. Our culture is autonomous with a heavy emphasis on work/life balance.What youll do...You will be embedded in a cross functional (frontend/backend) team and assist with the development of our node based backend. Your duties will include developing maintaining and performing an active contributor role over our software. You will be expected to take requirements and deliver production level code effectively and in a timely manner. In addition with your experience you will voice your opinions on software architecture and start to perform code reviews. Our team uses an agile kanban development approach and is a fully remote team.Responsibilities:
Develop high-quality software design and architecture
Taking ownership of new feature development and bug fixes
Develop tools and applications by producing clean efficient code
Automate tasks through appropriate tools and scripting
Review and debug code
Perform validation and verification testing
Collaborate with internal teams and vendors to fix and improve products
RequirementsRequired: 
Minimum 3 years professional experience (or 1 year with a computer science degree) as a Front-End developer 
Significant experience with frontend frameworks such as Angular 10+/Material
Experience with frontend mapping frameworks such as OpenLayers Leaflet Google maps ESRI
Strong written and verbal communication skills and the ability to work asynchronously
Familiarity with agile kanban development process
Analytical mind with problem-solving aptitude
Desired:
Experience with GIS software
Experience with a remote development team
Familiarity with unit and component testing
Experience with testing frameworks such as Cypress Jasmine/Karma/Protractor
BenefitsWhat we offer:
$95K - $145K -  Salary range is based on years of experience experience in industry and relevant skill set.
401(K) + 4% Match
Medical dental vision
No vacation limit minimum 3 weeks
Half day summer Fridays
Work from anywhere / 100% remote (office available in Boulder CO if you prefer working onsite)
Originally posted on Himalayas",2024-01-12,United States,2024-01-12 00:09:24.419292
DevOps Engineer with German,https://himalayas.app/companies/accesa-raro/jobs/devops-engineer-with-german,"Company DescriptionPart of the Ratiodata Group Accesa is a leading technology company headquartered in Cluj-Napoca with offices in Oradea and Munich. Over the past 18 years the company has been establishing itself as an employer of choice for IT professionals who are passionate about problem-solving through technology and want to have a measurable impact through their work. A trusted partner for major brands in Retail Consumer Goods Manufacturing and Automotive Accesa helps businesses embrace flexibility adaptability and evolution within their digital journey through a large spectrum of tailored IT services leveraging mainstream niche as well as legacy technologies.Its sister-company RaRo delivers complex digital evolution solutions for highly regulated industries like Insurance and Banking and together the two companies cover the complete digital evolution journey of their customers from hardware to software and managed services solutions. With more than 1000 IT professionals in its 12 Competence Areas and 5 Technical Offices the two sister companies join forces to build a distinctive people-first culture that enables their people to thrive their clients’ business to evolve and end-users to succeed. Job Description
Create and implement platform-level cloud native system architectures with a focus on low latency high throughput and high availability.
Apply understanding of Cloud Native Principles to design solutions that optimize performance in both Private (Red Hat OpenShift) and Public Cloud environments (AWS/GCP/Azure).
Design and build cloud-native applications leveraging expertise in cloud platforms such as Docker Kubernetes and OpenShift.
Modernize large and complex technology solutions by transitioning them to cloud environments.
Develop distributed micro-service systems utilizing Service Mesh products/frameworks like Envoy Istio and gRPC/ProtoBuf.
Implement Distributed System Management/tracing and monitoring solutions including Zipkin/Jaeger ELK Stack Prometheus Grafana and Kiali.
Implement and optimize CICD processes using tools such as Jenkins Ansible Terraform and HELM.
Streamline deployment pipelines to enhance scalability productivity and efficiency.
Demonstrate expertise in Red Hat OpenShift ensuring its effective use in the development and deployment of applications.
Leverage OpenShift to enhance scalability productivity and security.
Implement solutions that support scalability to accommodate growing workloads and user demands.
Ensure the security of cloud-native architectures by implementing best practices and integrating security measures into the development and deployment processes.
Real impact one step at a time Crafting powerful cloud-native systems on Red Hat OpenShift and major public clouds using Docker Kubernetes and OpenShift. Specializing in modernization microservices streamlined CICD and advanced observability for optimal performance and efficiency.Professional opportunitiesAlongside performing day to day tasks you’ll have the opportunity to improve both your technical skills (by working with different tools and platforms) and your soft skills (by taking part in trainings).Community insightsThe team is backed-up by a competence center that supports professional development according to the individual needs and the project context.Qualifications
Understanding of Cloud Native Principles and architectures and Experience in creating platform level cloud native system architecture with low latency high throughput and high availability.
Knowledge and experience in building complex solutions and developing cloud native architectures on Private (Red Hat OpenShift) and Public Cloud (AWS /GCP/Azure) and modernizing large and complex technology solutions to cloud environments.
Have experience in designing and building Cloud native applications. Experience in cloud platforms like Docker Kubernetes OpenShift are a plus.
Experience in building distributed micro-service systems experience with Service Mesh products/frameworks like Envoy Istio gRPC/ProtoBuf; Distributed System Management/tracing and monitoring such as Zipkin/Jaeger ELK Stack Prometheus
Experience with Continuous Integration and Continuous Delivery (CICD) tools and processes (Example: Jenkins Ansible Terraform HELM etc.)
OpenShift Container Platform knowledge
Proven expertise in designing scalable solutions for diverse workloads enhancing productivity and efficiency.
Strong background in implementing robust security measures within cloud-native architectures ensuring system reliability.
Demonstrated skill in implementing effective observability practices and fostering simplified communication within teams.
Nice to have:
Cloud certifications (Azure/AWS/GCP)
RedHat certification
Additional InformationAt Accesa &amp; RARo you can:Enjoy our holistic benefits program that covers the four pillars that we believe come together to support our wellbeing covering social physical emotional wellbeing as well as work-life fusion.
Physical: premium medical package for both our colleagues and their children dental coverage up to a yearly amount eyeglasses reimbursement every two years voucher for sport equipment expenses in-house personal trainer
Emotional: individual therapy sessions with a certified psychotherapist webinars on self-development topics
Social: virtual activities sports challenges special occasions get-togethers
Work-life fusion: yearly increase in days off flexible working schedule birthday holiday and loyalty gifts for major milestones
Originally posted on Himalayas",2024-01-12,Romania,2024-01-12 00:09:24.495785
