title,link,description,pubdate,location,timestamp
Senior Customer Success Manager (Fully Remote) ,https://www.remoteimpact.io/jobs/people-and-talent-coordinator-6-month-contract-40-hour-40-hours-week-khan-academy-c8fe6,"Remote Impact JobsFor EmployersPeople and Talent Coordinator (6-month contract $40/hour 40 hours/week)Khan AcademyLocation: Mountain View CA / Remote friendly (US + Canada Only) Posted: 11/12/2023SubmitGet more jobs like this straight to your inboxApply for this job 
    

    ABOUT KHAN ACADEMY
Khan Academy is a nonprofit with the mission to deliver a free world-class education to anyone anywhere. Our proven learning platform offers free high-quality supplemental learning content and practice that cover Pre-K - 12th grade and early college core academic subjects focusing on math and science. We have over 155 million registered learners globally and are committed to improving learning outcomes for students worldwide focusing on learners in historically under-resourced communities.
OUR COMMUNITY&nbsp;
Our students teachers and parents come from all walks of life and so do we.&nbsp;Our team includes people from academia traditional/non-traditional education big tech companies and tiny startups. We hire great people from diverse backgrounds and experiences because it makes our company stronger.&nbsp;We value diversity equity inclusion and belonging as necessary to achieve our mission and impact the communities we serve.&nbsp;We know that transforming education starts in-house with learning about ourselves and our colleagues. We strive to be world-class in investing in our people and commit to developing you as a professional.
THE ROLE
Works as part of the People Operations Team to provide full cycle talent acquisition and HR operations support. This role will be responsible for such duties as supporting the recruitment process by crafting job descriptions preparing job offer letters conducting compensation analyses maintaining candidate databases coordinating interviews and assisting with onboarding. Additionally you will:

Provide support throughout the various hiring phases including candidate attraction resume screening interview scheduling and hiring communication management.
Schedule interviews; oversee preparation of interview guides toolkits and other hiring and selection materials.
Collaborate with hiring managers to identify and draft detailed and accurate job descriptions and hiring criteria.
Facilitate hiring managers through the appropriate hiring process gaining required approvals.
Provide coordination and administrative support for HR initiatives and projects.
Support implementation upgrades or changes to HRIS platforms.
Coordinate monitor and audit information entered into HRIS platforms.
Troubleshoot and resolve internal stakeholder HRIS issues.
Respond to external and internal general inquiries and requests.
Performs other duties as assigned.

WHAT YOU BRING

Motivated by the Khan Academy mission “to provide a free world-class education for anyone anywhere.”
Proven cross-cultural competency skills demonstrating self-awareness awareness of others and the ability to adopt inclusive perspectives attitudes and behaviors to drive inclusion and belonging throughout the organization.
Developing knowledge of HR policies and best practices.&nbsp;&nbsp;&nbsp;&nbsp;&nbsp;
3 to 5 years related experience.
Excellent verbal and written communication skills.
Proficient with or the ability to quickly learn applicant-tracking software or other recruitment systems and various HRIS platforms.
Hands-on experience with full-cycle recruiting using various interview techniques and evaluation methods preferred.
Self-starter with ability to work through ambiguity while remaining nimble.

KEY CORE COMPETENCIES

Delivers Results for Impact - Aware of the overall objective prioritizes tasks effectively and achieves desired outcomes that benefit the organizations mission.
Communication and Engagement - Shares appropriate information with relevant individuals at the appropriate time and in a suitable manner. Actively listens to facilitate understanding and effective communication.
Inclusive Collaboration - Collaborates effectively with a diverse team fostering a supportive environment where everyone feels valued empowered and free to contribute towards a shared goal.
Leadership - Leverage strengths to guide cross-functional collaboration and inspire others to contribute towards achieving shared objectives.
Problem Solving - Uses knowledge of the organization to solve problems and accomplish goals. Exercise sound reasoning to analyze issues synthesize information make decisions and solve problems.

MORE ABOUT US

Sal’s TED talk from 2011
Sal’s TED talk from 2015
Sals TED talk from 2023
Our team:&nbsp; http://www.khanacademy.org/about/the-team

OUR COMPANY VALUES
Live &amp; breathe learners
We deeply understand and empathize with our users. We leverage user insights research and experience to build content products services and experiences that our users trust and love. Our success is defined by the success of our learners and educators.
Take a stand
As a company we have conviction in our aspirational point of view of how education will evolve. The work we do is in service to moving towards that point of view. However we also listen learn and flex in the face of new data and commit to evolving this point of view as the industry and our users evolve.
Embrace diverse perspectives
We are a diverse community. We seek out and embrace a diversity of voices perspectives and life experiences leading to stronger more inclusive teams and better outcomes. As individuals we are committed to bringing up tough topics and leaning into different points of view with curiosity. We actively listen learn and collaborate to gain a shared understanding. When a decision is made we commit to moving forward as a united team.
Work responsibly and sustainably
We understand that achieving our audacious mission is a marathon so we set realistic timelines and we focus on delivery that also links to the bigger picture. As a non-profit we are supported by the generosity of donors as well as strategic partners and understand our responsibility to our finite resources. We spend every dollar as though it were our own. We are responsible for the impact we have on the world and to each other. We ensure our team and company stay healthy and financially sustainable.
Bring out the joy
We are committed to making learning a joyful process. This informs what we build for our users and the culture we co-create with our teammates partners and donors.
Cultivate learning mindset
We believe in the power of growth for learners and for ourselves. We constantly learn and teach to improve our offerings ourselves and our organization. We learn from our mistakes and aren’t afraid to fail. We dont let past failures or successes stop us from taking future bold action and achieving our goals.
Deliver wow
We insist on high standards and deliver delightful effective end-to-end experiences that our users can rely on. We choose to focus on fewer things — each of which aligns to our ambitious vision — so we can deliver high-quality experiences that accelerate positive measurable learning with our strategic partners.
We are committed to equal employment opportunity regardless of race color ancestry religion sex gender gender identity or expression national origin sexual orientation age citizenship marital status disability or Veteran status. We value diversity equity and inclusion and we encourage candidates from historically underrepresented groups to apply.

    

    
Apply for this jobRemote Impact JobsFind a remote job in a mission-led organisation making positive change in the world.Subscribe to our newsletter:SubmitPopular Skillsremote react jobsremote python jobsremote frontend jobsremote backend jobsremote php jobsremote ios developer jobsremote linux jobsPopular Impact Areasclimate change remote jobseducation remote jobshealthcare remote jobsfood and agriculture remote jobs© 2023 Remote Impact. All Rights Reserved.By continuing to use this site you accept our privacy and cookie policy.OKprops:pageProps:jobs:_id:6577d07231160ca0232e49f6id:c8fe6company:Khan Academyrole:People and Talent Coordinator (6-month contract $40/hour 40 hours/week)description:\u003cdiv id=\content\ class=\\\u003e\n    \n\n    \u003cp data-renderer-start-pos=\59\\u003e\u003cstrong data-renderer-mark=\true\\u003eABOUT KHAN ACADEMY\u003c/strong\u003e\u003c/p\u003e\n\u003cp data-renderer-start-pos=\79\\u003eKhan Academy is a nonprofit with the mission to deliver a free world-class education to anyone anywhere. Our proven learning platform offers free high-quality supplemental learning content and practice that cover Pre-K - 12th grade and early college core academic subjects focusing on math and science. We have over 155 million registered learners globally and are committed to improving learning outcomes for students worldwide focusing on learners in historically under-resourced communities.\u003c/p\u003e\n\u003cp data-renderer-start-pos=\581\\u003e\u003cstrong data-renderer-mark=\true\\u003eOUR COMMUNITY \u003c/strong\u003e\u003c/p\u003e\n\u003cp data-renderer-start-pos=\597\\u003eOur students teachers and parents come from all walks of life and so do we. Our team includes people from academia traditional/non-traditional education big tech companies and tiny startups. We hire great people from diverse backgrounds and experiences because it makes our company stronger. We value diversity equity inclusion and belonging as necessary to achieve our mission and impact the communities we serve. We know that transforming education starts in-house with learning about ourselves and our colleagues. We strive to be world-class in investing in our people and commit to developing you as a professional.\u003c/p\u003e\n\u003cp\u003e\u003cspan style=\font-weight: 400;\\u003e\u003cstrong\u003eTHE ROLE\u003c/strong\u003e\u003cbr\u003e\u003c/span\u003e\u003c/p\u003e\n\u003cp\u003eWorks as part of the People Operations Team to provide full cycle talent acquisition and HR operations support. This role will be responsible for such duties as supporting the recruitment process by crafting job descriptions preparing job offer letters conducting compensation analyses maintaining candidate databases coordinating interviews and assisting with onboarding. Additionally you will:\u003c/p\u003e\n\u003cul\u003e\n\u003cli\u003eProvide support throughout the various hiring phases including candidate attraction resume screening interview scheduling and hiring communication management.\u003c/li\u003e\n\u003cli\u003eSchedule interviews; oversee preparation of interview guides toolkits and other hiring and selection materials.\u003c/li\u003e\n\u003cli\u003eCollaborate with hiring managers to identify and draft detailed and accurate job descriptions and hiring criteria.\u003c/li\u003e\n\u003cli\u003eFacilitate hiring managers through the appropriate hiring process gaining required approvals.\u003c/li\u003e\n\u003cli\u003eProvide coordination and administrative support for HR initiatives and projects.\u003c/li\u003e\n\u003cli\u003eSupport implementation upgrades or changes to HRIS platforms.\u003c/li\u003e\n\u003cli\u003eCoordinate monitor and audit information entered into HRIS platforms.\u003c/li\u003e\n\u003cli\u003eTroubleshoot and resolve internal stakeholder HRIS issues.\u003c/li\u003e\n\u003cli\u003eRespond to external and internal general inquiries and requests.\u003c/li\u003e\n\u003cli\u003ePerforms other duties as assigned.\u003c/li\u003e\n\u003c/ul\u003e\n\u003cp\u003e\u003cstrong\u003eWHAT YOU BRING\u003c/strong\u003e\u003c/p\u003e\n\u003cul\u003e\n\u003cli\u003eMotivated by the Khan Academy mission “to provide a free world-class education for anyone anywhere.”\u003c/li\u003e\n\u003cli\u003eProven cross-cultural competency skills demonstrating self-awareness awareness of others and the ability to adopt inclusive perspectives attitudes and behaviors to drive inclusion and belonging throughout the organization.\u003c/li\u003e\n\u003cli\u003eDeveloping knowledge of HR policies and best practices.     \u003c/li\u003e\n\u003cli\u003e3 to 5 years related experience.\u003c/li\u003e\n\u003cli\u003eExcellent verbal and written communication skills.\u003c/li\u003e\n\u003cli\u003eProficient with or the ability to quickly learn applicant-tracking software or other recruitment systems and various HRIS platforms.\u003c/li\u003e\n\u003cli\u003eHands-on experience with full-cycle recruiting using various interview techniques and evaluation methods preferred.\u003c/li\u003e\n\u003cli\u003eSelf-starter with ability to work through ambiguity while remaining nimble.\u003c/li\u003e\n\u003c/ul\u003e\n\u003cp\u003e\u003cstrong\u003eKEY CORE COMPETENCIES\u003c/strong\u003e\u003c/p\u003e\n\u003cul\u003e\n\u003cli\u003e\u003cem\u003eDelivers Results for Impact\u003c/em\u003e - Aware of the overall objective prioritizes tasks effectively and achieves desired outcomes that benefit the organizations mission.\u003c/li\u003e\n\u003cli\u003e\u003cem\u003eCommunication and Engagement\u003c/em\u003e - Shares appropriate information with relevant individuals at the appropriate time and in a suitable manner. Actively listens to facilitate understanding and effective communication.\u003c/li\u003e\n\u003cli\u003e\u003cem\u003eInclusive Collaboration\u003c/em\u003e - Collaborates effectively with a diverse team fostering a supportive environment where everyone feels valued empowered and free to contribute towards a shared goal\u003cem\u003e.\u003c/em\u003e\u003c/li\u003e\n\u003cli\u003e\u003cem\u003eLeadership\u003c/em\u003e - Leverage strengths to guide cross-functional collaboration and inspire others to contribute towards achieving shared objectives.\u003c/li\u003e\n\u003cli\u003e\u003cem\u003eProblem Solving\u003c/em\u003e - Uses knowledge of the organization to solve problems and accomplish goals. Exercise sound reasoning to analyze issues synthesize information make decisions and solve problems.\u003c/li\u003e\n\u003c/ul\u003e\n\u003ch3\u003e\u003cstrong\u003eMORE ABOUT US\u003c/strong\u003e\u003c/h3\u003e\n\u003cul\u003e\n\u003cli style=\font-weight: 400;\\u003e\u003ca href=\http://www.ted.com/talks/salman_khan_let_s_use_video_to_reinvent_education\\u003e\u003cspan style=\font-weight: 400;\\u003eSal’s TED talk from 2011\u003c/span\u003e\u003c/a\u003e\u003c/li\u003e\n\u003cli style=\font-weight: 400;\\u003e\u003ca href=\http://www.ted.com/talks/sal_khan_let_s_teach_for_mastery_not_test_scores\\u003e\u003cspan style=\font-weight: 400;\\u003eSal’s TED talk from 2015\u003c/span\u003e\u003c/a\u003e\u003c/li\u003e\n\u003cli style=\font-weight: 400;\\u003e\u003ca href=\https://www.ted.com/talks/sal_khan_how_ai_could_save_not_destroy_education\\u003e\u003cspan style=\font-weight: 400;\\u003eSals TED talk from 2023\u003c/span\u003e\u003c/a\u003e\u003c/li\u003e\n\u003cli style=\font-weight: 400;\\u003e\u003cspan style=\font-weight: 400;\\u003eOur team:  \u003c/span\u003e\u003ca href=\http://www.khanacademy.org/about/the-team\\u003e\u003cspan style=\font-weight: 400;\\u003ehttp://www.khanacademy.org/about/the-team\u003c/span\u003e\u003c/a\u003e\u003c/li\u003e\n\u003c/ul\u003e\n\u003ch3\u003e\u003cstrong\u003eOUR COMPANY VALUES\u003c/strong\u003e\u003c/h3\u003e\n\u003cp data-renderer-start-pos=\2541\\u003e\u003cstrong data-renderer-mark=\true\\u003eLive \u0026amp; breathe learners\u003c/strong\u003e\u003c/p\u003e\n\u003cp data-renderer-start-pos=\2566\\u003eWe deeply understand and empathize with our users. We leverage user insights research and experience to build content products services and experiences that our users trust and love. Our success is defined by the success of our learners and educators.\u003c/p\u003e\n\u003cp data-renderer-start-pos=\2824\\u003e\u003cstrong data-renderer-mark=\true\\u003eTake a stand\u003c/strong\u003e\u003c/p\u003e\n\u003cp data-renderer-start-pos=\2838\\u003eAs a company we have conviction in our aspirational point of view of how education will evolve. The work we do is in service to moving towards that point of view. However we also listen learn and flex in the face of new data and commit to evolving this point of view as the industry and our users evolve.\u003c/p\u003e\n\u003cp data-renderer-start-pos=\3148\\u003e\u003cstrong data-renderer-mark=\true\\u003eEmbrace diverse perspectives\u003c/strong\u003e\u003c/p\u003e\n\u003cp data-renderer-start-pos=\3178\\u003eWe are a diverse community. We seek out and embrace a diversity of voices perspectives and life experiences leading to stronger more inclusive teams and better outcomes. As individuals we are committed to bringing up tough topics and leaning into different points of view with curiosity. We actively listen learn and collaborate to gain a shared understanding. When a decision is made we commit to moving forward as a united team.\u003c/p\u003e\n\u003cp data-renderer-start-pos=\3615\\u003e\u003cstrong data-renderer-mark=\true\\u003eWork responsibly and sustainably\u003c/strong\u003e\u003c/p\u003e\n\u003cp data-renderer-start-pos=\3649\\u003eWe understand that achieving our audacious mission is a marathon so we set realistic timelines and we focus on delivery that also links to the bigger picture. As a non-profit we are supported by the generosity of donors as well as strategic partners and understand our responsibility to our finite resources. We spend every dollar as though it were our own. We are responsible for the impact we have on the world and to each other. We ensure our team and company stay healthy and financially sustainable.\u003c/p\u003e\n\u003cp data-renderer-start-pos=\4158\\u003e\u003cstrong data-renderer-mark=\true\\u003eBring out the joy\u003c/strong\u003e\u003c/p\u003e\n\u003cp data-renderer-start-pos=\4177\\u003eWe are committed to making learning a joyful process. This informs what we build for our users and the culture we co-create with our teammates partners and donors.\u003c/p\u003e\n\u003cp data-renderer-start-pos=\4343\\u003e\u003cstrong data-renderer-mark=\true\\u003eCultivate learning mindset\u003c/strong\u003e\u003c/p\u003e\n\u003cp data-renderer-start-pos=\4371\\u003eWe believe in the power of growth for learners and for ourselves. We constantly learn and teach to improve our offerings ourselves and our organization. We learn from our mistakes and aren’t afraid to fail. We dont let past failures or successes stop us from taking future bold action and achieving our goals.\u003c/p\u003e\n\u003cp data-renderer-start-pos=\4685\\u003e\u003cstrong data-renderer-mark=\true\\u003eDeliver wow\u003c/strong\u003e\u003c/p\u003e\n\u003cp data-renderer-start-pos=\4698\\u003eWe insist on high standards and deliver delightful effective end-to-end experiences that our users can rely on. We choose to focus on fewer things — each of which aligns to our ambitious vision — so we can deliver high-quality experiences that accelerate positive measurable learning with our strategic partners.\u003c/p\u003e\n\u003cp data-renderer-start-pos=\5013\\u003e\u003cem data-renderer-mark=\true\\u003eWe are committed to equal employment opportunity regardless of race color ancestry religion sex gender gender identity or expression national origin sexual orientation age citizenship marital status disability or Veteran status. We value diversity equity and inclusion and we encourage candidates from historically underrepresented groups to apply.\u003c/em\u003e\u003c/p\u003e\n\n    \n\n    \n\u003c/div\u003eimpact:sdg1sdg4location:Mountain View CA / Remote friendly (US + Canada Only)link:https://boards.greenhouse.io/khanacademy/jobs/5563933slug:people-and-talent-coordinator-6-month-contract-40-hour-40-hours-week-khan-academy-c8fe6date:2023-12-12T03:16:01.710Ztags:hq:status:remote:salaryMin:0salaryMax:0approved:false__N_SSP:truepage:/jobs/slugquery:slug:people-and-talent-coordinator-6-month-contract-40-hour-40-hours-week-khan-academy-c8fe6buildId:LqM2mYzRohf_0wBi8sEjqisFallback:falsegssp:truescriptLoader:id:gastrategy:lazyOnloadsrc:https://www.googletagmanager.com/gtag/js?id=G-XZG534BGMNid:ga2strategy:lazyOnloadchildren:\n                    window.dataLayer = window.dataLayer || ;\n                    function gtag()dataLayer.push(arguments);\n                    gtag(js new Date());\n                    gtag(config G-XZG534BGMN \n                    page_path: window.location.pathname\n                    );\n                
                    window.dataLayer = window.dataLayer || ;
                    function gtag()dataLayer.push(arguments);
                    gtag(js new Date());
                    gtag(config G-XZG534BGMN 
                    page_path: window.location.pathname
                    );
                ",2023-12-11,Remot,2023-12-11 22:00:23.986886
