title,link,description,pubdate,location,timestamp
Senior Salesforce Developer- Classy ,https://www.remoteimpact.io/jobs/senior-customer-success-manager-fully-remote-caremessage-81c98,"This Serverless Function has timed out.
Your connection is working correctly.Vercel is working correctly.504: GATEWAY_TIMEOUT
Code: FUNCTION_INVOCATION_TIMEOUT
ID: cle1::9qhsr-1702353659859-0408b2354a4bIf you are a visitor contact the website owner or try again later.If you are the owner learn how to fix the error and check the logs.
",2023-12-11,Worldwide,2023-12-11 22:00:24.196124
Staff Product Manager (Incubation) ,https://www.remoteimpact.io/apply/81c98,Senior Customer Success Manager (Fully Remote)RemoteCustomer Experience – Customer Success Management /Full-Time/ RemoteSubmit your applicationResume/CV ✱ATTACH RESUME/CVCouldnt auto-read resume.Analyzing resume...Success!File exceeds the maximum upload size of 100MB. Please try a smaller size.Full name✱Email✱Phone ✱Current company ✱CSM experienceDo you have 5+ years of experience working as CSM with at least 1 year as a Senior CSM?✱Select yes or noYesNoDescribe your current or most recent Senior CSM role scope your customer portfolio and how you went about driving retention and product adoption in your role. It would helpful to start with a short description of your company and market.✱Do you have recent experience using Salesforce?✱Select...YesNoDo you have recent experience using Gainsight?✱Select...YesNoAdditional QuestionsDo you have experience working remotely?✱YesNoAre you able to travel to meet with customers or partners on a periodic basis (e.g. 1-2 times every 3 months)?✱YesNoWill you work authorization to work in the United States?✱Select...YesNoWill you work authorization to work in the Canada?✱Select...YesNoWhy are you interested in working at CareMessage?Additional informationSubmit applicationCareMessage Home PageJobs powered by var subDomain = document.location.hostname;var rootDomain = subDomain.split(.).reverse().splice(0 2).reverse().join(.);function removeCookie(cookieName) document.cookie = cookieName + =; expires=Thu 01 Jan 1970 00:00:00 UTC; path=/; domain= + subDomain + ;;document.cookie = cookieName + =; expires=Thu 01 Jan 1970 00:00:00 UTC; path=/; domain= + rootDomain + ;;var GA_COOKIES = _gid _ga _gat_customer;GA_COOKIES.forEach(function(cookie) removeCookie(cookie););,2023-12-11,Worldwide,2023-12-11 22:00:24.302701
HR Business Partner Americas ,https://www.remoteimpact.io/jobs/contractor-candidate-experience-specialist-est-gitlab-45313,"Remote Impact JobsFor EmployersContractor - Candidate Experience Specialist (EST)GitlabLocation: Remote US Posted: 11/12/2023devopsSubmitGet more jobs like this straight to your inboxApply for this job 
    The GitLab&nbsp;DevSecOps platform&nbsp;empowers 100000+ organizations to deliver software faster and more efficiently. We are one of the&nbsp;world’s largest all-remote companies&nbsp;with 2000+ team members and&nbsp;values&nbsp;that foster a culture where people embrace the belief that everyone can contribute. Learn more about&nbsp;Life at GitLab.

    An overview of this role
This is a one year contract position located in the US in Eastern time zone.
The GitLab Candidate Experience Specialists work to create positive experiences for GitLab candidates and hiring teams. In a growing fast-paced environment the Candidate Experience Specialist is a dynamic team member who helps create an amazing candidate experience improve our existing hiring practices and deliver exceptional results to our hiring teams. GitLab strives to be a preferred employer and relies on the Candidate Experience Specialists to act as brand ambassadors by embodying the company values during every interaction with potential team members. The Candidate Experience Specialist is enthusiastic about working with high volume and is dedicated to helping GitLab build a qualified diverse and motivated team. The Candidate Experience Specialist reports to the Manager Candidate Experience.
Don’t have a ton of knowledge about GitLab yet? Don’t worry. We have an extensive onboarding and training program at GitLab and you will be provided with necessary DevOps and GitLab knowledge to fulfill your role.
What you’ll do&nbsp;

Collaborate with Recruiters hiring teams and Recruiting leadership to understand and implement the hiring plan for each job requisition
Coordinate with the Recruiters to maintain correct process information in the Applicant Tracking System (ATS) and GitLab repositories
Build and update an effective network of internal and external resources to call on as needed
Ensure candidates receive timely thoughtful and engaging messaging throughout the hiring process
Work in Applicant Tracking System (ATS) to help recruiters maintain a positive candidate experience for candidates
Helps manage candidate traffic for all roles
Act as the&nbsp;Recruiting Coordinator for the interview process
Create and stage employment contracts for candidates receiving an offer of employment on behalf of the hiring manager and recruiter
Work to create a seamless handoff of new team members to the&nbsp;People Operations Specialist&nbsp;team
Promote our values culture and remote only passion

What you’ll bring

Desire to learn about Talent Acquisition and GitLab from the ground level
Demonstrated ability to work in a team environment with a focus on delivering an excellent customer or candidate experience
Ambitious efficient and consistent under tight deadlines and competing priorities
Proficient in Google Workspace
Ability to build relationships with team members hiring managers and colleagues across multiple disciplines and timezones
Outstanding written and verbal communication skills
Willingness to learn and use software tools
Organized efficient and proactive with a keen sense of urgency
Excellent communication and interpersonal skills
Ability to recognize and appropriately handle highly sensitive and confidential information
Experience working remotely is a plus
Share our&nbsp;values and work in accordance with those values

Also we know it’s tough but please try to avoid the ​​confidence gap​.​​ You don’t have to match all the listed requirements exactly to be considered for this role.
How GitLab will support you

All remote&nbsp;asynchronous&nbsp;work environment

Please note since this is a contract role this position is not eligible for benefits or equity.
&nbsp;

    The base salary range for this role’s listed level is currently for residents of listed locations only. Grade level and salary ranges are determined through interviews and a review of education experience knowledge skills abilities of the applicant equity with other team members and alignment with market data. See more information on our benefits and equity. Sales roles are also eligible for incentive pay targeted at up to 100% of the offered base salary.Colorado/Washington pay range$22.88—$35 USDCalifornia/New York/New Jersey pay range$22.88—$35 USD

    
Country Hiring Guidelines: GitLab hires new team members in countries around the world. All of our roles are remote however some roles may carry specific location-based eligibility requirements. Our Talent Acquisition team can help answer any questions about location after starting the recruiting process.&nbsp;&nbsp;
Privacy Policy: Please review our Recruitment Privacy Policy. Your privacy is important to us.
GitLab is proud to be an equal opportunity workplace and is an affirmative action employer. GitLab’s policies and practices relating to recruitment employment career development and advancement promotion and retirement are based solely on merit regardless of race color religion ancestry sex (including pregnancy lactation sexual orientation gender identity or gender expression) national origin age citizenship marital status mental or physical disability genetic information (including family medical history) discharge status from the military protected veteran status (which includes disabled veterans recently separated veterans active duty wartime or campaign badge veterans and Armed Forces service medal veterans) or any other basis protected by law. GitLab will not tolerate discrimination or harassment based on any of these characteristics. See also&nbsp;GitLab’s EEO Policy&nbsp;and&nbsp;EEO is the Law. If you have a disability or special need that requires&nbsp;accommodation please let us know during the&nbsp;recruiting process.
Apply for this jobRemote Impact JobsFind a remote job in a mission-led organisation making positive change in the world.Subscribe to our newsletter:SubmitPopular Skillsremote react jobsremote python jobsremote frontend jobsremote backend jobsremote php jobsremote ios developer jobsremote linux jobsPopular Impact Areasclimate change remote jobseducation remote jobshealthcare remote jobsfood and agriculture remote jobs© 2023 Remote Impact. All Rights Reserved.By continuing to use this site you accept our privacy and cookie policy.OKprops:pageProps:jobs:_id:6577a52c87a5e108742a3d8aid:45313company:Gitlabrole:Contractor - Candidate Experience Specialist (EST)description:\u003cdiv id=\content\ class=\\\u003e\n    \u003cdiv class=\content-intro\\u003e\u003cp\u003eThe GitLab \u003ca class=\c-link\ href=\https://about.gitlab.com/solutions/devops-platform/\ target=\_blank\ data-stringify-link=\https://about.gitlab.com/solutions/devops-platform/\ data-sk=\tooltip_parent\ data-remove-tab-index=\true\\u003eDevSecOps platform\u003c/a\u003e empowers 100000+ organizations to deliver software faster and more efficiently. We are one of the \u003ca class=\c-link\ href=\https://about.gitlab.com/company/culture/all-remote/guide/\ target=\_blank\ data-stringify-link=\https://about.gitlab.com/company/culture/all-remote/guide/\ data-sk=\tooltip_parent\ data-remove-tab-index=\true\\u003eworld’s largest all-remote companies\u003c/a\u003e with 2000+ team members and \u003ca class=\c-link\ href=\https://handbook.gitlab.com/handbook/values/\ target=\_blank\ data-stringify-link=\https://about.gitlab.com/handbook/values/\ data-sk=\tooltip_parent\ data-remove-tab-index=\true\\u003evalues\u003c/a\u003e that foster a culture where people embrace the belief that everyone can contribute. Learn more about \u003ca class=\c-link\ href=\https://vimeo.com/778157354\ target=\_blank\ data-stringify-link=\https://vimeo.com/778157354\ data-sk=\tooltip_parent\ data-remove-tab-index=\true\\u003eLife at GitLab\u003c/a\u003e.\u003c/p\u003e\u003c/div\u003e\n\n    \u003cp\u003e\u003cstrong\u003eAn overview of this role\u003c/strong\u003e\u003c/p\u003e\n\u003cp\u003eThis is a one year contract position located in the US in Eastern time zone.\u003c/p\u003e\n\u003cp\u003eThe GitLab Candidate Experience Specialists work to create positive experiences for GitLab candidates and hiring teams. In a growing fast-paced environment the Candidate Experience Specialist is a dynamic team member who helps create an amazing candidate experience improve our existing hiring practices and deliver exceptional results to our hiring teams. GitLab strives to be a preferred employer and relies on the Candidate Experience Specialists to act as brand ambassadors by embodying the company values during every interaction with potential team members. The Candidate Experience Specialist is enthusiastic about working with high volume and is dedicated to helping GitLab build a qualified diverse and motivated team. The Candidate Experience Specialist reports to the Manager Candidate Experience.\u003c/p\u003e\n\u003cp\u003e\u003cspan style=\font-weight: 400;\\u003eDon’t have a ton of knowledge about GitLab yet? Don’t worry. We have an extensive onboarding and training program at GitLab and you will be provided with necessary DevOps and GitLab knowledge to fulfill your role.\u003c/span\u003e\u003c/p\u003e\n\u003ch4\u003e\u003cstrong\u003eWhat you’ll do\u003c/strong\u003e \u003c/h4\u003e\n\u003cul\u003e\n\u003cli\u003eCollaborate with Recruiters hiring teams and Recruiting leadership to understand and implement the hiring plan for each job requisition\u003c/li\u003e\n\u003cli\u003eCoordinate with the Recruiters to maintain correct process information in the Applicant Tracking System (ATS) and GitLab repositories\u003c/li\u003e\n\u003cli\u003eBuild and update an effective network of internal and external resources to call on as needed\u003c/li\u003e\n\u003cli\u003eEnsure candidates receive timely thoughtful and engaging messaging throughout the hiring process\u003c/li\u003e\n\u003cli\u003eWork in Applicant Tracking System (ATS) to help recruiters maintain a positive candidate experience for candidates\u003c/li\u003e\n\u003cli\u003eHelps manage candidate traffic for all roles\u003c/li\u003e\n\u003cli\u003eAct as the \u003ca href=\https://about.gitlab.com/handbook/hiring/talent-acquisition-framework/coordinator/\\u003eRecruiting Coordinator\u003c/a\u003e for the interview process\u003c/li\u003e\n\u003cli\u003eCreate and stage employment contracts for candidates receiving an offer of employment on behalf of the hiring manager and recruiter\u003c/li\u003e\n\u003cli\u003eWork to create a seamless handoff of new team members to the \u003ca href=\https://about.gitlab.com/job-families/people-ops/people-operations/\\u003ePeople Operations Specialist\u003c/a\u003e team\u003c/li\u003e\n\u003cli\u003ePromote our values culture and remote only passion\u003c/li\u003e\n\u003c/ul\u003e\n\u003ch4 id=\requirements\ class=\header-link-title\\u003e\u003cstrong\u003eWhat you’ll bring\u003c/strong\u003e\u003c/h4\u003e\n\u003cul\u003e\n\u003cli\u003eDesire to learn about Talent Acquisition and GitLab from the ground level\u003c/li\u003e\n\u003cli\u003eDemonstrated ability to work in a team environment with a focus on delivering an excellent customer or candidate experience\u003c/li\u003e\n\u003cli\u003eAmbitious efficient and consistent under tight deadlines and competing priorities\u003c/li\u003e\n\u003cli\u003eProficient in Google Workspace\u003c/li\u003e\n\u003cli\u003eAbility to build relationships with team members hiring managers and colleagues across multiple disciplines and timezones\u003c/li\u003e\n\u003cli\u003eOutstanding written and verbal communication skills\u003c/li\u003e\n\u003cli\u003eWillingness to learn and use software tools\u003c/li\u003e\n\u003cli\u003eOrganized efficient and proactive with a keen sense of urgency\u003c/li\u003e\n\u003cli\u003eExcellent communication and interpersonal skills\u003c/li\u003e\n\u003cli\u003eAbility to recognize and appropriately handle highly sensitive and confidential information\u003c/li\u003e\n\u003cli\u003eExperience working remotely is a plus\u003c/li\u003e\n\u003cli\u003eShare our \u003ca href=\https://about.gitlab.com/handbook/values/\\u003evalues\u003c/a\u003e and work in accordance with those values\u003c/li\u003e\n\u003c/ul\u003e\n\u003cp\u003e\u003cspan style=\font-weight: 400;\\u003eAlso we know it’s tough but please try to avoid the ​​confidence gap​.​​ You don’t have to match all the listed requirements exactly to be considered for this role.\u003c/span\u003e\u003c/p\u003e\n\u003ch4\u003e\u003cstrong\u003eHow GitLab will support you\u003c/strong\u003e\u003c/h4\u003e\n\u003cul\u003e\n\u003cli\u003e\u003ca href=\https://about.gitlab.com/company/culture/all-remote/guide/\\u003eAll remote\u003c/a\u003e \u003ca href=\https://about.gitlab.com/company/culture/all-remote/asynchronous/\\u003easynchronous\u003c/a\u003e work environment\u003c/li\u003e\n\u003c/ul\u003e\n\u003cp\u003e\u003cem\u003ePlease note since this is a contract role this position is not eligible for benefits or equity.\u003c/em\u003e\u003c/p\u003e\n\u003cp\u003e \u003c/p\u003e\n\n    \u003cdiv class=\content-pay-transparency\\u003e\u003cdiv class=\pay-input\\u003e\u003cdiv class=\description\\u003e\u003cem\u003e\u003cspan data-sheets-formula-bar-text-style=\font-size:12px;color:#000000;font-weight:normal;text-decoration:none;font-family:Arial;font-style:normal;text-decoration-skip-ink:none;\\u003eThe base salary range for this role’s listed level is currently for residents of listed locations only. Grade level and salary ranges are determined through interviews and a review of education experience knowledge skills abilities of the applicant equity with other team members and alignment with market data. See more information on our \u003c/span\u003e\u003ca class=\waffle-rich-text-link\ href=\https://about.gitlab.com/handbook/total-rewards/benefits/general-and-entity-benefits/\ data-sheets-formula-bar-text-link=\https://bit.ly/GLBeneUS\ data-sheets-formula-bar-text-style=\font-size:12px;color:#1155cc;font-weight:normal;text-decoration:underline;font-family:Arial;font-style:normal;text-decoration-skip-ink:none;\\u003ebenefits\u003c/a\u003e\u003cspan data-sheets-formula-bar-text-style=\font-size:12px;color:#000000;font-weight:normal;text-decoration:none;font-family:Arial;font-style:normal;text-decoration-skip-ink:none;\\u003e and \u003c/span\u003e\u003ca class=\waffle-rich-text-link\ href=\https://about.gitlab.com/handbook/stock-options/\ data-sheets-formula-bar-text-link=\https://bit.ly/GLequity\ data-sheets-formula-bar-text-style=\font-size:12px;color:#1155cc;font-weight:normal;text-decoration:underline;font-family:Arial;font-style:normal;text-decoration-skip-ink:none;\\u003eequity\u003c/a\u003e\u003cspan data-sheets-formula-bar-text-style=\font-size:12px;color:#000000;font-weight:normal;text-decoration:none;font-family:Arial;font-style:normal;text-decoration-skip-ink:none;\\u003e. Sales roles are also eligible for incentive pay targeted at up to 100% of the offered base salary.\u003c/span\u003e\u003c/em\u003e\u003c/div\u003e\u003cdiv class=\title\\u003eColorado/Washington pay range\u003c/div\u003e\u003cdiv class=\pay-range\\u003e\u003cspan\u003e$22.88\u003c/span\u003e\u003cspan class=\divider\\u003e—\u003c/span\u003e\u003cspan\u003e$35 USD\u003c/span\u003e\u003c/div\u003e\u003c/div\u003e\u003cdiv class=\pay-input\\u003e\u003cdiv class=\title\\u003eCalifornia/New York/New Jersey pay range\u003c/div\u003e\u003cdiv class=\pay-range\\u003e\u003cspan\u003e$22.88\u003c/span\u003e\u003cspan class=\divider\\u003e—\u003c/span\u003e\u003cspan\u003e$35 USD\u003c/span\u003e\u003c/div\u003e\u003c/div\u003e\u003c/div\u003e\n\n    \u003cdiv class=\content-conclusion\\u003e\u003chr\u003e\n\u003cp\u003e\u003cstrong\u003eCountry Hiring Guidelines: \u003c/strong\u003eGitLab hires new team members in countries around the world. All of our roles are remote however some roles may carry specific location-based eligibility requirements. Our Talent Acquisition team can help answer any questions about location after starting the recruiting process.  \u003c/p\u003e\n\u003cp\u003e\u003cstrong\u003ePrivacy Policy: \u003c/strong\u003ePlease review our \u003ca href=\https://about.gitlab.com/handbook/hiring/candidate/faq/recruitment-privacy-policy/\ target=\_blank\\u003eRecruitment Privacy Policy.\u003c/a\u003e Your privacy is important to us.\u003c/p\u003e\n\u003cp\u003eGitLab is proud to be an equal opportunity workplace and is an affirmative action employer. GitLab’s policies and practices relating to recruitment employment career development and advancement promotion and retirement are based solely on merit regardless of race color religion ancestry sex (including pregnancy lactation sexual orientation gender identity or gender expression) national origin age citizenship marital status mental or physical disability genetic information (including family medical history) discharge status from the military protected veteran status (which includes disabled veterans recently separated veterans active duty wartime or campaign badge veterans and Armed Forces service medal veterans) or any other basis protected by law. GitLab will not tolerate discrimination or harassment based on any of these characteristics. See also \u003ca href=\https://about.gitlab.com/handbook/people-policies/inc-usa/#equal-employment-opportunity-policy\ target=\_blank\\u003eGitLab’s EEO Policy\u003c/a\u003e and \u003ca href=\https://about.gitlab.com/handbook/labor-and-employment-notices/#eeoc-us-equal-employment-opportunity-commission-notices\ target=\_blank\\u003eEEO is the Law\u003c/a\u003e. If you have a disability or special need that requires \u003ca href=\https://about.gitlab.com/handbook/people-policies/inc-usa/#reasonable-accommodation\ target=\_blank\\u003eaccommodation\u003c/a\u003e please let us know during the \u003ca href=\https://about.gitlab.com/handbook/hiring/interviewing/#adjustments-to-our-interview-process\ target=\_blank\\u003erecruiting process\u003c/a\u003e.\u003c/p\u003e\u003c/div\u003e\n\u003c/div\u003eimpact:sdg1location:Remote USlink:https://boards.greenhouse.io/gitlab/jobs/7057022002slug:contractor-candidate-experience-specialist-est-gitlab-45313date:2023-12-12T00:11:23.617Ztags:devopshq:status:remote:salaryMin:0salaryMax:0approved:false__N_SSP:truepage:/jobs/slugquery:slug:contractor-candidate-experience-specialist-est-gitlab-45313buildId:LqM2mYzRohf_0wBi8sEjqisFallback:falsegssp:truescriptLoader:id:gastrategy:lazyOnloadsrc:https://www.googletagmanager.com/gtag/js?id=G-XZG534BGMNid:ga2strategy:lazyOnloadchildren:\n                    window.dataLayer = window.dataLayer || ;\n                    function gtag()dataLayer.push(arguments);\n                    gtag(js new Date());\n                    gtag(config G-XZG534BGMN \n                    page_path: window.location.pathname\n                    );\n                
                    window.dataLayer = window.dataLayer || ;
                    function gtag()dataLayer.push(arguments);
                    gtag(js new Date());
                    gtag(config G-XZG534BGMN 
                    page_path: window.location.pathname
                    );
                ",2023-12-11,Canada Remote,2023-12-11 22:00:24.413479
