title,link,description,pubdate,location,timestamp
District Operations Associate ,https://www.remoteimpact.io/jobs/district-operations-associate-khan-academy-99815,"Remote Impact JobsFor EmployersDistrict Operations AssociateKhan AcademyLocation: Mountain View CA / Remote friendly (US + Canada Only) Posted: 11/12/2023salesforceSubmitGet more jobs like this straight to your inboxApply for this job 
    

    ABOUT KHAN ACADEMY
Khan Academy is a nonprofit with the mission to deliver a free world-class education to anyone anywhere. Our proven learning platform offers free high-quality supplemental learning content and practice that cover Pre-K - 12th grade and early college core academic subjects focusing on math and science. We have over 155 million registered learners globally and are committed to improving learning outcomes for students worldwide focusing on learners in historically under-resourced communities.
OUR COMMUNITY&nbsp;
Our students teachers and parents come from all walks of life and so do we.&nbsp;Our team includes people from academia traditional/non-traditional education big tech companies and tiny startups. We hire great people from diverse backgrounds and experiences because it makes our company stronger.&nbsp;We value diversity equity inclusion and belonging as necessary to achieve our mission and impact the communities we serve.&nbsp;We know that transforming education starts in-house with learning about ourselves and our colleagues. We strive to be world-class in investing in our people and commit to developing you as a professional.
THE ROLE
Khan Academy is seeking a District Operations Associate excited to join a small team with big goals. We are seeking someone passionate about supporting school districts and educators. This role involves a high level of team collaboration to manage general operations tailored to each districts needs. The ideal candidate should be highly professional capable of handling multiple tasks simultaneously and an excellent communicator for clear and prompt interactions. This role requires exceptional organizational skills and the ability to manage change. A key responsibility of the Operations Associate is to schedule professional learning sessions for school districts. In addition the Operations Associate will undertake other tasks to support success and professional learning such as creating educator-facing documents organizing data and resources and other activities to assist school districts.
What youll do:

Establish and manage a robust system to schedule plan and execute the delivery of Khan Academy’s critical professional learning program to partner districts; adeptly handling all aspects of coordination with school districts and responding to changes and cancellations.
Organize and manage the PL specialists’ schedules to ensure smooth execution of key meetings events and travel.&nbsp;
Support the Success team’s implementations and overall district partnership by engaging directly with school district personnel for planning scheduling and special projects.
Administer contract renewal processes liaise with the legal team and escalate relevant requests to Sales and Success leaders.&nbsp;
Responsible for organizing inputting and auditing Success and PL data in Salesforce to track the teams’ activities and performance.&nbsp;
Work with Success Managers to compile District usage data to support the Success team’s mid-year and year-end District data reviews.&nbsp;
Populate information into slide decks one-pagers and other educator resources.
Oversee other operational tasks as needed demonstrating adaptability and initiative.

WHAT YOU BRING

3-5 years experience as a program manager scheduler or similar experience
3 years of previous experience working in education (Grades 6-12 preferred)
2 years of previous experience working with Salesforce
Motivated by the Khan Academy mission “to provide a free world-class education for anyone anywhere
Proven cross-cultural competency skills demonstrating self-awareness awareness of other and the ability to adopt inclusive perspectives attitudes and behaviors to drive inclusion and belonging throughout the organization
Strong organizational skills - the ability to manage multiple tasks concurrently from start to finish&nbsp;
Excellent computer skills including Google Suite and Zoom&nbsp;
Advanced oral and written communication skills.
Ability to fulfill assigned tasks with minimal supervision

PERKS AND BENEFITS
We may be a non-profit but we reward our talented team extremely well! We offer:

Competitive salaries
Ample paid time off as needed – Your well-being is a priority.
Remote-first culture - that caters to your time zone with open flexibility as needed at times
Generous parental leave
An exceptional team that trusts you and gives you the freedom to do your best
The chance to put your talents towards a deeply meaningful mission and the opportunity to work on high-impact products that are already defining the future of education
Opportunities to connect through affinity ally and social groups
And we offer all those other typical benefits as well: 401(k) + 4% matching &amp; comprehensive insurance including medical dental vision and life

At Khan Academy we are committed to fair and equitable compensation practices the well-being of our employees and our Khan community. This belief is why we have built out a robust Total Rewards package that includes competitive base salaries and extensive benefits and perks to support physical mental and financial well-being.
The target salary range for this position is $77600 - $97000 USD. The pay range for this position is a general guideline only. The salary offered will depend on internal pay equity and the candidate’s relevant skills experience qualifications and job market data. Exceptional performers in this role who make an outsized contribution can make well in excess of this range. &nbsp;Additional incentives are provided as part of the complete total rewards package in addition to comprehensive medical and other benefits.
MORE ABOUT US

Sal’s TED talk from 2011
Sal’s TED talk from 2015
Sals TED talk from 2023
Our team:&nbsp; http://www.khanacademy.org/about/the-team

OUR COMPANY VALUES
Live &amp; breathe learners
We deeply understand and empathize with our users. We leverage user insights research and experience to build content products services and experiences that our users trust and love. Our success is defined by the success of our learners and educators.
Take a stand
As a company we have conviction in our aspirational point of view of how education will evolve. The work we do is in service to moving towards that point of view. However we also listen learn and flex in the face of new data and commit to evolving this point of view as the industry and our users evolve.
Embrace diverse perspectives
We are a diverse community. We seek out and embrace a diversity of voices perspectives and life experiences leading to stronger more inclusive teams and better outcomes. As individuals we are committed to bringing up tough topics and leaning into different points of view with curiosity. We actively listen learn and collaborate to gain a shared understanding. When a decision is made we commit to moving forward as a united team.
Work responsibly and sustainably
We understand that achieving our audacious mission is a marathon so we set realistic timelines and we focus on delivery that also links to the bigger picture. As a non-profit we are supported by the generosity of donors as well as strategic partners and understand our responsibility to our finite resources. We spend every dollar as though it were our own. We are responsible for the impact we have on the world and to each other. We ensure our team and company stay healthy and financially sustainable.
Bring out the joy
We are committed to making learning a joyful process. This informs what we build for our users and the culture we co-create with our teammates partners and donors.
Cultivate learning mindset
We believe in the power of growth for learners and for ourselves. We constantly learn and teach to improve our offerings ourselves and our organization. We learn from our mistakes and aren’t afraid to fail. We dont let past failures or successes stop us from taking future bold action and achieving our goals.
Deliver wow
We insist on high standards and deliver delightful effective end-to-end experiences that our users can rely on. We choose to focus on fewer things — each of which aligns to our ambitious vision — so we can deliver high-quality experiences that accelerate positive measurable learning with our strategic partners.
We are committed to equal employment opportunity regardless of race color ancestry religion sex gender gender identity or expression national origin sexual orientation age citizenship marital status disability or Veteran status. We value diversity equity and inclusion and we encourage candidates from historically underrepresented groups to apply.

    

    
Apply for this jobRemote Impact JobsFind a remote job in a mission-led organisation making positive change in the world.Subscribe to our newsletter:SubmitPopular Skillsremote react jobsremote python jobsremote frontend jobsremote backend jobsremote php jobsremote ios developer jobsremote linux jobsPopular Impact Areasclimate change remote jobseducation remote jobshealthcare remote jobsfood and agriculture remote jobs© 2023 Remote Impact. All Rights Reserved.By continuing to use this site you accept our privacy and cookie policy.OKprops:pageProps:jobs:_id:6577d07631160ca0232e49f7id:99815company:Khan Academyrole:District Operations Associatedescription:\u003cdiv id=\content\ class=\\\u003e\n    \n\n    \u003cp data-renderer-start-pos=\59\\u003e\u003cstrong data-renderer-mark=\true\\u003eABOUT KHAN ACADEMY\u003c/strong\u003e\u003c/p\u003e\n\u003cp data-renderer-start-pos=\79\\u003eKhan Academy is a nonprofit with the mission to deliver a free world-class education to anyone anywhere. Our proven learning platform offers free high-quality supplemental learning content and practice that cover Pre-K - 12th grade and early college core academic subjects focusing on math and science. We have over 155 million registered learners globally and are committed to improving learning outcomes for students worldwide focusing on learners in historically under-resourced communities.\u003c/p\u003e\n\u003cp data-renderer-start-pos=\581\\u003e\u003cstrong data-renderer-mark=\true\\u003eOUR COMMUNITY \u003c/strong\u003e\u003c/p\u003e\n\u003cp data-renderer-start-pos=\597\\u003eOur students teachers and parents come from all walks of life and so do we. Our team includes people from academia traditional/non-traditional education big tech companies and tiny startups. We hire great people from diverse backgrounds and experiences because it makes our company stronger. We value diversity equity inclusion and belonging as necessary to achieve our mission and impact the communities we serve. We know that transforming education starts in-house with learning about ourselves and our colleagues. We strive to be world-class in investing in our people and commit to developing you as a professional.\u003c/p\u003e\n\u003cp\u003e\u003cspan style=\font-weight: 400;\\u003e\u003cstrong\u003eTHE ROLE\u003c/strong\u003e\u003c/span\u003e\u003c/p\u003e\n\u003cp\u003eKhan Academy is seeking a District Operations Associate excited to join a small team with big goals. We are seeking someone passionate about supporting school districts and educators. This role involves a high level of team collaboration to manage general operations tailored to each districts needs. The ideal candidate should be highly professional capable of handling multiple tasks simultaneously and an excellent communicator for clear and prompt interactions. This role requires exceptional organizational skills and the ability to manage change. A key responsibility of the Operations Associate is to schedule professional learning sessions for school districts. In addition the Operations Associate will undertake other tasks to support success and professional learning such as creating educator-facing documents organizing data and resources and other activities to assist school districts.\u003c/p\u003e\n\u003cp\u003eWhat youll do:\u003c/p\u003e\n\u003cul\u003e\n\u003cli\u003eEstablish and manage a robust system to schedule plan and execute the delivery of Khan Academy’s critical professional learning program to partner districts; adeptly handling all aspects of coordination with school districts and responding to changes and cancellations.\u003c/li\u003e\n\u003cli\u003eOrganize and manage the PL specialists’ schedules to ensure smooth execution of key meetings events and travel. \u003c/li\u003e\n\u003cli\u003eSupport the Success team’s implementations and overall district partnership by engaging directly with school district personnel for planning scheduling and special projects.\u003c/li\u003e\n\u003cli\u003eAdminister contract renewal processes liaise with the legal team and escalate relevant requests to Sales and Success leaders. \u003c/li\u003e\n\u003cli\u003eResponsible for organizing inputting and auditing Success and PL data in Salesforce to track the teams’ activities and performance. \u003c/li\u003e\n\u003cli\u003eWork with Success Managers to compile District usage data to support the Success team’s mid-year and year-end District data reviews. \u003c/li\u003e\n\u003cli\u003ePopulate information into slide decks one-pagers and other educator resources.\u003c/li\u003e\n\u003cli\u003eOversee other operational tasks as needed demonstrating adaptability and initiative.\u003c/li\u003e\n\u003c/ul\u003e\n\u003cp\u003e\u003cstrong\u003eWHAT YOU BRING\u003c/strong\u003e\u003c/p\u003e\n\u003cul\u003e\n\u003cli\u003e3-5 years experience as a program manager scheduler or similar experience\u003c/li\u003e\n\u003cli\u003e3 years of previous experience working in education (Grades 6-12 preferred)\u003c/li\u003e\n\u003cli\u003e2 years of previous experience working with Salesforce\u003c/li\u003e\n\u003cli\u003eMotivated by the Khan Academy mission “to provide a free world-class education for anyone anywhere\\u003c/li\u003e\n\u003cli\u003eProven cross-cultural competency skills demonstrating self-awareness awareness of other and the ability to adopt inclusive perspectives attitudes and behaviors to drive inclusion and belonging throughout the organization\u003c/li\u003e\n\u003cli\u003eStrong organizational skills - the ability to manage multiple tasks concurrently from start to finish \u003c/li\u003e\n\u003cli\u003eExcellent computer skills including Google Suite and Zoom \u003c/li\u003e\n\u003cli\u003eAdvanced oral and written communication skills.\u003c/li\u003e\n\u003cli\u003eAbility to fulfill assigned tasks with minimal supervision\u003c/li\u003e\n\u003c/ul\u003e\n\u003cp\u003e\u003cstrong\u003ePERKS AND BENEFITS\u003c/strong\u003e\u003c/p\u003e\n\u003cp data-renderer-start-pos=\1639\\u003eWe may be a non-profit but we reward our talented team extremely well! We offer:\u003c/p\u003e\n\u003cul class=\ak-ul\ data-indent-level=\1\\u003e\n\u003cli\u003eCompetitive salaries\u003c/li\u003e\n\u003cli\u003eAmple paid time off as needed – Your well-being is a priority.\u003c/li\u003e\n\u003cli\u003eRemote-first culture - that caters to your time zone with open flexibility as needed at times\u003c/li\u003e\n\u003cli\u003eGenerous parental leave\u003c/li\u003e\n\u003cli\u003eAn exceptional team that trusts you and gives you the freedom to do your best\u003c/li\u003e\n\u003cli\u003eThe chance to put your talents towards a deeply meaningful mission and the opportunity to work on high-impact products that are already defining the future of education\u003c/li\u003e\n\u003cli\u003eOpportunities to connect through affinity ally and social groups\u003c/li\u003e\n\u003cli\u003eAnd we offer all those other typical benefits as well: 401(k) + 4% matching \u0026amp; comprehensive insurance including medical dental vision and life\u003c/li\u003e\n\u003c/ul\u003e\n\u003cp\u003eAt Khan Academy we are committed to fair and equitable compensation practices the well-being of our employees and our Khan community. This belief is why we have built out a robust Total Rewards package that includes competitive base salaries and extensive benefits and perks to support physical mental and financial well-being.\u003c/p\u003e\n\u003cp\u003eThe target salary range for this position is $77600 - $97000 USD. The pay range for this position is a general guideline only. The salary offered will depend on internal pay equity and the candidate’s relevant skills experience qualifications and job market data. Exceptional performers in this role who make an outsized contribution can make well in excess of this range.  Additional incentives are provided as part of the complete total rewards package in addition to comprehensive medical and other benefits.\u003c/p\u003e\n\u003ch3\u003e\u003cstrong\u003eMORE ABOUT US\u003c/strong\u003e\u003c/h3\u003e\n\u003cul\u003e\n\u003cli style=\font-weight: 400;\\u003e\u003ca href=\http://www.ted.com/talks/salman_khan_let_s_use_video_to_reinvent_education\\u003e\u003cspan style=\font-weight: 400;\\u003eSal’s TED talk from 2011\u003c/span\u003e\u003c/a\u003e\u003c/li\u003e\n\u003cli style=\font-weight: 400;\\u003e\u003ca href=\http://www.ted.com/talks/sal_khan_let_s_teach_for_mastery_not_test_scores\\u003e\u003cspan style=\font-weight: 400;\\u003eSal’s TED talk from 2015\u003c/span\u003e\u003c/a\u003e\u003c/li\u003e\n\u003cli style=\font-weight: 400;\\u003e\u003ca href=\https://www.ted.com/talks/sal_khan_how_ai_could_save_not_destroy_education\\u003e\u003cspan style=\font-weight: 400;\\u003eSals TED talk from 2023\u003c/span\u003e\u003c/a\u003e\u003c/li\u003e\n\u003cli style=\font-weight: 400;\\u003e\u003cspan style=\font-weight: 400;\\u003eOur team:  \u003c/span\u003e\u003ca href=\http://www.khanacademy.org/about/the-team\\u003e\u003cspan style=\font-weight: 400;\\u003ehttp://www.khanacademy.org/about/the-team\u003c/span\u003e\u003c/a\u003e\u003c/li\u003e\n\u003c/ul\u003e\n\u003ch3\u003e\u003cstrong\u003eOUR COMPANY VALUES\u003c/strong\u003e\u003c/h3\u003e\n\u003cp data-renderer-start-pos=\2541\\u003e\u003cstrong data-renderer-mark=\true\\u003eLive \u0026amp; breathe learners\u003c/strong\u003e\u003c/p\u003e\n\u003cp data-renderer-start-pos=\2566\\u003eWe deeply understand and empathize with our users. We leverage user insights research and experience to build content products services and experiences that our users trust and love. Our success is defined by the success of our learners and educators.\u003c/p\u003e\n\u003cp data-renderer-start-pos=\2824\\u003e\u003cstrong data-renderer-mark=\true\\u003eTake a stand\u003c/strong\u003e\u003c/p\u003e\n\u003cp data-renderer-start-pos=\2838\\u003eAs a company we have conviction in our aspirational point of view of how education will evolve. The work we do is in service to moving towards that point of view. However we also listen learn and flex in the face of new data and commit to evolving this point of view as the industry and our users evolve.\u003c/p\u003e\n\u003cp data-renderer-start-pos=\3148\\u003e\u003cstrong data-renderer-mark=\true\\u003eEmbrace diverse perspectives\u003c/strong\u003e\u003c/p\u003e\n\u003cp data-renderer-start-pos=\3178\\u003eWe are a diverse community. We seek out and embrace a diversity of voices perspectives and life experiences leading to stronger more inclusive teams and better outcomes. As individuals we are committed to bringing up tough topics and leaning into different points of view with curiosity. We actively listen learn and collaborate to gain a shared understanding. When a decision is made we commit to moving forward as a united team.\u003c/p\u003e\n\u003cp data-renderer-start-pos=\3615\\u003e\u003cstrong data-renderer-mark=\true\\u003eWork responsibly and sustainably\u003c/strong\u003e\u003c/p\u003e\n\u003cp data-renderer-start-pos=\3649\\u003eWe understand that achieving our audacious mission is a marathon so we set realistic timelines and we focus on delivery that also links to the bigger picture. As a non-profit we are supported by the generosity of donors as well as strategic partners and understand our responsibility to our finite resources. We spend every dollar as though it were our own. We are responsible for the impact we have on the world and to each other. We ensure our team and company stay healthy and financially sustainable.\u003c/p\u003e\n\u003cp data-renderer-start-pos=\4158\\u003e\u003cstrong data-renderer-mark=\true\\u003eBring out the joy\u003c/strong\u003e\u003c/p\u003e\n\u003cp data-renderer-start-pos=\4177\\u003eWe are committed to making learning a joyful process. This informs what we build for our users and the culture we co-create with our teammates partners and donors.\u003c/p\u003e\n\u003cp data-renderer-start-pos=\4343\\u003e\u003cstrong data-renderer-mark=\true\\u003eCultivate learning mindset\u003c/strong\u003e\u003c/p\u003e\n\u003cp data-renderer-start-pos=\4371\\u003eWe believe in the power of growth for learners and for ourselves. We constantly learn and teach to improve our offerings ourselves and our organization. We learn from our mistakes and aren’t afraid to fail. We dont let past failures or successes stop us from taking future bold action and achieving our goals.\u003c/p\u003e\n\u003cp data-renderer-start-pos=\4685\\u003e\u003cstrong data-renderer-mark=\true\\u003eDeliver wow\u003c/strong\u003e\u003c/p\u003e\n\u003cp data-renderer-start-pos=\4698\\u003eWe insist on high standards and deliver delightful effective end-to-end experiences that our users can rely on. We choose to focus on fewer things — each of which aligns to our ambitious vision — so we can deliver high-quality experiences that accelerate positive measurable learning with our strategic partners.\u003c/p\u003e\n\u003cp data-renderer-start-pos=\5013\\u003e\u003cem data-renderer-mark=\true\\u003eWe are committed to equal employment opportunity regardless of race color ancestry religion sex gender gender identity or expression national origin sexual orientation age citizenship marital status disability or Veteran status. We value diversity equity and inclusion and we encourage candidates from historically underrepresented groups to apply.\u003c/em\u003e\u003c/p\u003e\n\n    \n\n    \n\u003c/div\u003eimpact:sdg1sdg4location:Mountain View CA / Remote friendly (US + Canada Only)link:https://boards.greenhouse.io/khanacademy/jobs/5559095slug:district-operations-associate-khan-academy-99815date:2023-12-12T03:16:06.222Ztags:salesforcehq:status:remote:salaryMin:78salaryMax:97approved:false__N_SSP:truepage:/jobs/slugquery:slug:district-operations-associate-khan-academy-99815buildId:LqM2mYzRohf_0wBi8sEjqisFallback:falsegssp:truescriptLoader:id:gastrategy:lazyOnloadsrc:https://www.googletagmanager.com/gtag/js?id=G-XZG534BGMNid:ga2strategy:lazyOnloadchildren:\n                    window.dataLayer = window.dataLayer || ;\n                    function gtag()dataLayer.push(arguments);\n                    gtag(js new Date());\n                    gtag(config G-XZG534BGMN \n                    page_path: window.location.pathname\n                    );\n                
                    window.dataLayer = window.dataLayer || ;
                    function gtag()dataLayer.push(arguments);
                    gtag(js new Date());
                    gtag(config G-XZG534BGMN 
                    page_path: window.location.pathname
                    );
                ",2023-12-11,Mountain View CA   Remote friendly (US + Canada Only),2023-12-11 22:00:23.755473
